Unnamed: 0	date	favorites	geo	hashtags	id	mentions	permalink	retweets	text	username	neg	neu	pos	compound
630	2017-10-11 19:07:02	5.0		[]	9.18251625475e+17	[]	https://twitter.com/brobert545/status/918251625474609152	2.0	Gloria Allred was not starting a class action lawsuit to drain Harvey of millions. Simple as that. Why did Ashley Judd come forward? Late?	brobert545 Lrihendry siggyturbo997	0.093	0.907	0.0	-0.3094
631	2017-10-11 19:05:36	0.0		[]	9.18251265964e+17	[]	https://twitter.com/SnoopaDo/status/918251265963982851	0.0	I would give that crown to Meryl Streep.  Close second Ashley Judd or Rosie O.	SnoopaDo sinkspur nedryun	0.0	1.0	0.0	0.0
632	2017-10-11 19:04:44	0.0		[]	9.18251047844e+17	[]	https://twitter.com/TommyBridgeH2O/status/918251047843516416	0.0	Harvey Weinstein was so powerful that Angelina Jolie, Ashley Judd & Gwyneth Paltrow didn't say NOTHING until... http://fb.me/794Me5fdZ	TommyBridgeH2O	0.0	0.816	0.184	0.5598
633	2017-10-11 19:04:37	0.0		[]	9.18251016462e+17	[]	https://twitter.com/SNap33/status/918251016461737985	1.0	I guess Ashley Judd and liberals took a knee on Harvey Weinstein.	SNap33	0.0	1.0	0.0	0.0
634	2017-10-11 19:01:08	0.0		[]	9.18250142763e+17	[]	https://twitter.com/krekked/status/918250142762860545	0.0	Men and women must be very different. I don't understand why some chick ( Ashley Judd I'm lookin at you) didn't just bite his schnitzel off.	krekked ForeverSpectre AmericanSpectre	0.0	1.0	0.0	0.0
635	2017-10-11 19:00:53	0.0		[]	9.18250078448e+17	[]	https://twitter.com/HopeToday4You/status/918250078447591424	0.0	Ashley Judd ’s Fact-Based Human Trafficking Film Sets United Nations Premiere — Watch https://buff.ly/2xThiYs	HopeToday4You	0.0	0.823	0.177	0.4215
636	2017-10-11 18:57:54	1.0		[]	9.18249325545e+17	[]	https://twitter.com/smwpuddenbucks7/status/918249325544837120	0.0	Where is MADONNA and that nasty women ASHLEY JUDD ? Why are they not protesting?  Come on!	smwpuddenbucks7 FoxNews	0.207	0.68	0.113	-0.4442
637	2017-10-11 18:57:05	0.0		[u'#harveyweinstien', u'#Heath']	9.1824912291e+17	[]	https://twitter.com/Retweetthat17/status/918249122909638658	0.0	What’s the difference between #harveyweinstien case & #Heath? 40 people spoke out a long time ago just like Ashley Judd .	Retweetthat17 BBCNewsnight KirstyWark	0.0	0.872	0.128	0.3612
638	2017-10-11 18:55:37	0.0		[]	9.1824875457e+17	[]	https://twitter.com/Trish403/status/918248754569818113	0.0	Yes You have all those stellar examples and you also have Bill Clinton, Harvey Weinstein, Rosie, Ashley Judd etc.. odds are against you bud	Trish403 WajahatAli	0.0	0.895	0.105	0.4019
639	2017-10-11 18:53:20	0.0		[]	9.18248176695e+17	[]	https://twitter.com/TheMiamiQueet/status/918248176695459840	0.0	Ashley Judd is too busy talking about her period blood on her sheets to stand up to an actual sexual predator.	TheMiamiQueet jitotweets	0.0	1.0	0.0	0.0
640	2017-10-11 18:52:08	18.0		[]	9.1824787536e+17	[]	https://twitter.com/KTCarroll7/status/918247875359989760	5.0	When you are a pervert you will live her at home a go find that nasty Ashley Judd or HRC	KTCarroll7 tomesimpson	0.301	0.699	0.0	-0.7845
641	2017-10-11 18:45:25	0.0		[]	9.18246183718e+17	['@JimmyKimmelLive']	https://twitter.com/shyndixie/status/918246183717556224	0.0	@JimmyKimmelLive Ashley Judd knew Weinstein's abuses yet she only bitched about Trump.Stick to comedy you SOB instead of getting into poltcs	shyndixie	0.337	0.578	0.085	-0.8143
642	2017-10-11 18:44:34	0.0		[]	9.18245973054e+17	[]	https://twitter.com/JodieDonaghy1/status/918245973054377990	0.0	Can't wait for the pussy march.  Infact was Ashley Judd not at the last one!!	JodieDonaghy1 PrisonPlanet	0.0	1.0	0.0	0.0
643	2017-10-11 18:43:49	1.0		[]	9.18245784327e+17	[]	https://twitter.com/Schatzilein8/status/918245784327458817	0.0	"They sure did! Also dumb ass Ashley Judd or what ever her name is. The pussy wearing ""NASTY WOMEN"" .. lmao :-)"	Schatzilein8 Angellosangel	0.318	0.445	0.237	-0.6027
644	2017-10-11 18:43:02	0.0		[]	9.18245587665e+17	[]	https://twitter.com/smwpuddenbucks7/status/918245587664982016	0.0	Where's the protest from MADONNA and that nasty women ASHLEY JUDD ? What are they waiting for?	smwpuddenbucks7 THR	0.299	0.701	0.0	-0.7149
645	2017-10-11 18:41:27	16.0		[]	9.18245187575e+17	[]	https://twitter.com/PatriciaLRiver5/status/918245187574517761	7.0	Where is Merrill Streep, Ashley Judd , Oprah Winfrey, why haven't they come out and denounced Harvey Weinstein? A sexist misogynistic rapist?	PatriciaLRiver5 LetItBurnUSA DeannaRusso	0.217	0.783	0.0	-0.7399
646	2017-10-11 18:39:55	0.0		['#HarveyWeinstein', '#womansmarch']	9.18244802034e+17	[]	https://twitter.com/OldGloryCries/status/918244802034102272	0.0	When Ashley Judd & Madonna went ballistic at Trump, they were projecting the horrors they'd experienced with #HarveyWeinstein. #womansmarch	OldGloryCries	0.179	0.821	0.0	-0.5719
647	2017-10-11 18:39:46	0.0		[]	9.18244762574e+17	[]	https://twitter.com/quadvee/status/918244762574114816	0.0	dont forget powerful women like ashley judd who said nothing	quadvee rosemcgowan AsiaArgento	0.173	0.519	0.309	0.2105
648	2017-10-11 18:31:34	0.0		[]	9.18242701086e+17	[]	https://twitter.com/shicks_sam/status/918242701086220288	0.0	"It's a ruse. They decided to sacrifice Weinstein because they are sitting on a similar tape by Trump. 

Why else would bat crazy anti Trump Ashley Judd be coming out about this."	shicks_sam alex_amoralov	0.144	0.856	0.0	-0.5719
649	2017-10-11 18:23:22	0.0		[]	9.18240634511e+17	['@DailyMailCeleb']	https://twitter.com/carolehers/status/918240634510725121	0.0	Ashley Judd 's mother Naomi, 71, praises her daughter http://dailym.ai/2gcFXAs via @DailyMailCeleb	carolehers	0.0	0.764	0.236	0.5267
650	2017-10-11 18:21:38	2.0		[]	9.18240201168e+17	[]	https://twitter.com/WMccawber/status/918240201167826945	1.0	"Ashley Judd - the ""Nasty Woman"" who allowed a ""nasty man"" to silence her for fear of losing career opportunities"	WMccawber Speedcomesfirst cdkoct	0.455	0.455	0.091	-0.886
651	2017-10-11 18:20:52	1.0		[]	9.1824000922e+17	[u'@AshleyJudd']	https://twitter.com/IcpruittIan/status/918240009219690497	0.0	Ashley Judd Triggered Beyond Repair When Airport Employee Calls Her 'Swe...@AshleyJudd  exhibit Ahttps://www.youtube.com/watch?v=M0T7LckOxiQ&feature=share…	IcpruittIan	0.0	1.0	0.0	0.0
652	2017-10-11 18:20:51	0.0		[]	9.18240002798e+17	[]	https://twitter.com/GoddessHairTX/status/918240002798059520	0.0	That rap was worse than the one performed by psycho Ashley Judd	GoddessHairTX AlwaysActions realDonaldTrump	0.22	0.78	0.0	-0.4767
653	2017-10-11 18:19:46	0.0		[]	9.18239732249e+17	[]	https://twitter.com/FHughesAuthor/status/918239732248825856	0.0	You have no idea how much I’ve been slammed on Twitter for 3 days for making the same observation about Ashley Judd . Because I’m a man	FHughesAuthor michellemalkin IngrahamAngle	0.087	0.913	0.0	-0.296
654	2017-10-11 18:16:17	0.0		[]	9.18238853718e+17	[]	https://twitter.com/51NCY/status/918238853718265857	0.0	This is Ashley Judd level crazy	51NCY brielarson RileyStarship	0.324	0.676	0.0	-0.34
655	2017-10-11 18:14:42	12.0		[]	9.18238453611e+17	[]	https://twitter.com/KimNTennessee/status/918238453611094016	5.0	“How do I get out of the room as fast as possible without alienating Harvey Weinstein?”- Ashley Judd	KimNTennessee mikandynothem AshleyJudd	0.0	1.0	0.0	0.0
656	2017-10-11 18:14:03	46.0		[]	9.18238294022e+17	[]	https://twitter.com/JimTroy1/status/918238294021955584	6.0	Will not watch this show. Nasty woman Ashley Judd is in it	JimTroy1 BerlinStation EpixHD	0.247	0.753	0.0	-0.5574
657	2017-10-11 18:13:32	0.0		[]	9.18238162698e+17	[]	https://twitter.com/smwpuddenbucks7/status/918238162698362882	0.0	Where is MADONNA and that nasty women ASHLEY JUDD ? Why are they not protesting in HOLLYWOOD? Nasty PRODUCER Weinstein!	smwpuddenbucks7 THR	0.3	0.611	0.089	-0.7594
658	2017-10-11 18:12:21	0.0		[]	9.18237864332e+17	[]	https://twitter.com/GoddessHairTX/status/918237864332333056	0.0	Wven ashley judd who is a total psycho did better than him at rap. And that isn’t saying much	GoddessHairTX RealKyleMorris	0.0	0.854	0.146	0.4404
659	2017-10-11 18:06:02	0.0		[]	9.18236275224e+17	[]	https://twitter.com/AnnieSut2/status/918236275223564289	0.0	"Yep Ashley Judd sure is a ""nasty woman"".  She could have save other women if she had been a decent person & spoken out about Harvey"	AnnieSut2 mikandynothem AshleyJudd	0.119	0.627	0.254	0.4767
660	2017-10-11 18:04:58	0.0		[]	9.18236004267e+17	[]	https://twitter.com/romatoireland/status/918236004267495429	0.0	The left protects far worse. I short time ago Ashley Judd was saying she was a nasty women,offended, yet she was assaulted by Weinstein	romatoireland DHaines1 FoxNews	0.332	0.592	0.076	-0.8316
661	2017-10-11 18:04:13	1.0		[]	9.18235819248e+17	[u'@AshleyJudd']	https://twitter.com/IcpruittIan/status/918235819248414725	0.0	Ashley Judd Triggered Beyond Repair When Airport Employee Calls Her 'Swe...@AshleyJudd couldn't find the courage tohttps://www.youtube.com/watch?v=M0T7LckOxiQ&feature=share…	IcpruittIan	0.149	0.851	0.0	-0.3875
662	2017-10-11 18:03:55	0.0		[]	9.1823573985e+17	[]	https://twitter.com/smwpuddenbucks7/status/918235739850231809	0.0	Has anyone seen MADONNA and that nasty women ASHLEY JUDD ? Are they protesting that nasty Producer Weinstein.....oh I see one of there own!	smwpuddenbucks7 goldenglobes	0.351	0.649	0.0	-0.8832
663	2017-10-11 18:03:51	0.0		[]	9.18235724872e+17	[u'@nationalpost']	https://twitter.com/GigglingLama/status/918235724872261632	0.0	"""It is simply beyond time to have the conversation publicly."" - Ashley Judd http://nationalpost.com/wcm/ebbe012a-e561-4205-9f63-5c082bb8a2ed… via @nationalpost

● What a putz..really"	GigglingLama	0.0	1.0	0.0	0.0
664	2017-10-11 18:00:47	0.0		[]	9.18234954542e+17	['@DailyMailCeleb']	https://twitter.com/BackFenceBLAB/status/918234954542321670	0.0	via @DailyMailCeleb: Ashley Judd 's mother Naomi praises her daughter http://ow.ly/x8rx50eyptU	BackFenceBLAB	0.0	0.746	0.254	0.5267
665	2017-10-11 18:00:36	2.0		[]	9.18234906736e+17	[]	https://twitter.com/VicNocal/status/918234906735525888	1.0	"Why ""strong independent NAAASTY WOMAN"" Ashley Judd wait 20 years & 1 Hollywood career later 2call out Weinstein &not till someone spoke 1st?"	VicNocal VicNocal jaketapper AshleyJudd	0.0	0.858	0.142	0.5106
666	2017-10-11 17:59:59	0.0		['#HarveyWeinstein', '#BoycottHollywood']	9.18234752889e+17	[]	https://twitter.com/SJRutherford3/status/918234752888573960	0.0	Why N hell would this #HarveyWeinstein creep even be B N the same room w/that slut Ashley Judd ? Wait, nevr mind. My bad. #BoycottHollywood	SJRutherford3	0.398	0.602	0.0	-0.9169
667	2017-10-11 17:59:38	1.0		[]	9.18234663302e+17	[]	https://twitter.com/LKalkofen/status/918234663302451200	0.0	Let's hear Ashley Judd nasty woman rants about Weinstein!	LKalkofen FoxNews	0.469	0.531	0.0	-0.7345
668	2017-10-11 17:59:17	0.0		[]	9.18234576145e+17	['@Alyssa_Milano']	https://twitter.com/akitagirl3/status/918234576144629762	0.0	@Alyssa_Milano You were sexually harassed by Weinstein b/c he thought you were Ashley Judd . She was harassed b/c he said he liked her dress!	akitagirl3	0.235	0.675	0.09	-0.6696
669	2017-10-11 17:58:43	49.0		['#WeinSCREAM']	9.18234431387e+17	[]	https://twitter.com/MonaFishman/status/918234431386632192	23.0	Ashley Judd Praised For Coming Forward about #WeinSCREAM Basically her keeping it secret makes her responsible for every rape since her own	MonaFishman	0.161	0.651	0.188	-0.0516
670	2017-10-11 17:58:22	0.0		[]	9.18234343973e+17	[]	https://twitter.com/RFBHD52/status/918234343973228544	0.0	30 years of this everybody knew.  What a bunch of  Hippocrates. And Ashley Judd the biggest winer. Miss pussy hat. What a fraud!!!	RFBHD52 Lrihendry	0.248	0.752	0.0	-0.7412
671	2017-10-11 17:56:39	1.0		[]	9.18233914225e+17	[]	https://twitter.com/CiscoReyes80/status/918233914224848899	0.0	Id rather listen to Ashley Judd discuss women's rights! At least the double standards are coming from someone with an acting backround!	CiscoReyes80 Emmy_MAGA JackPosobiec tkamins123	0.0	1.0	0.0	0.0
672	2017-10-11 17:55:49	3.0		[]	9.18233701561e+17	[]	https://twitter.com/sandylaye/status/918233701561126912	1.0	What gets me is Ashley Judd having the nasty women's March against Pres. Trump while her&fellow actresses new what was going on n la la land	sandylaye	0.13	0.87	0.0	-0.5574
673	2017-10-11 17:54:59	3.0		[]	9.18233493821e+17	[u'@realDonaldTrump']	https://twitter.com/Clemicus/status/918233493821419520	1.0	Ashley Judd . A NASTY woman who hobnobbed with Harvey ranting about @realDonaldTrump who she didn't know. HYPOCRITE!!https://www.youtube.com/watch?v=ffb_5X59_DA…	Clemicus	0.247	0.753	0.0	-0.7111
674	2017-10-11 17:53:44	0.0		[]	9.18233179941e+17	[]	https://twitter.com/smwpuddenbucks7/status/918233179940642816	0.0	Al, any sign of MADONNA and that nasty women ASHLEY JUDD ? That's one nasty Producer Weinstein there in HOLLYWOOD & funds the democrats!	smwpuddenbucks7 FoxNews	0.273	0.727	0.0	-0.8172
675	2017-10-11 17:52:01	7.0		[]	9.18232746011e+17	[]	https://twitter.com/TomboyPrincess/status/918232746010599424	2.0	"Ashley Judd is brave
Emily Nestor is brave
Laura Madden is brave
Zelda Perkins is brave
Rose McGowan is brave
Asia Argento is brave"	TomboyPrincess TomboyPrincess	0.0	0.469	0.531	0.9657
676	2017-10-11 17:50:44	0.0		[]	9.1823242476e+17	[]	https://twitter.com/ArbanasPaul/status/918232424760463360	0.0	NBC execs are full of ball-less unamerican a-holes. Hippocrates for women, really? Hey Ashley Judd how's that hat fit now  lol https://twitter.com/trish_regan/status/918219683798515712…	ArbanasPaul trish_regan	0.0	0.791	0.209	0.6486
677	2017-10-11 17:49:38	0.0		[]	9.18232147626e+17	[]	https://twitter.com/horstpg/status/918232147625959424	0.0	"As a p_ssy rally ""nasty woman"" I wonder what Ashley Judd really did when Harvey Weinstein approached her in his bath robe??"	horstpg	0.172	0.828	0.0	-0.6072
678	2017-10-11 17:49:35	0.0		[]	9.18232136679e+17	[]	https://twitter.com/smwpuddenbucks7/status/918232136678887425	0.0	Dear Ted, any sign of MADONNA and that nasty women ASHLEY JUDD ? Wondering, are THEY protesting in HOLLYWOOD....NASTY PRODUCER!	smwpuddenbucks7 tedlieu	0.265	0.633	0.103	-0.6239
679	2017-10-11 17:48:56	0.0		[]	9.18231969754e+17	[]	https://twitter.com/day_rhonda/status/918231969753980934	0.0	Does anyone besides me remember Ashley Judd calling herself a nasty woman after Trump election. Apparently it’s ok to get groped for a part	day_rhonda mcgilh	0.14	0.775	0.085	-0.34
680	2017-10-11 17:46:54	0.0		[]	9.18231459819e+17	[]	https://twitter.com/meta1711/status/918231459818889217	0.0	With Ashley Judd !	meta1711 SnStell	0.0	1.0	0.0	0.0
681	2017-10-11 17:46:49	0.0		[]	9.18231437207e+17	[]	https://twitter.com/Zipad3dodah/status/918231437207310337	0.0	He was found to have paid off several women, but they were not part of the list for non-disclosure agreements. I believe Ashley Judd was.	Zipad3dodah Lily90	0.0	0.897	0.103	0.3919
682	2017-10-11 17:45:12	0.0		[]	9.18231030934e+17	['@Schlick51']	https://twitter.com/TheMrWulff12/status/918231030934450178	0.0	@Schlick51 answered a question on the app for Citizen Kane put in right answer. It populated Ashley Judd ??	TheMrWulff12	0.0	1.0	0.0	0.0
683	2017-10-11 17:45:00	0.0		[]	9.18230982998e+17	['@Katzekraus']	https://twitter.com/sandylaye/status/918230982997790721	2.0	@Katzekraus These are the most hypocritical ppl.The nasty women's March started by Ashley Judd all this time was OLE Harvey	sandylaye charliekirk11	0.284	0.716	0.0	-0.7996
684	2017-10-11 17:43:35	0.0		[]	9.18230625576e+17	[u'@MailOnline']	https://twitter.com/MyFactBrokers/status/918230625575878656	0.0	Ashley Judd : 'Women have been talking about Harvey amongst ourselves for a long time http://dailym.ai/2ygJxQE via @MailOnline	MyFactBrokers	0.0	1.0	0.0	0.0
685	2017-10-11 17:41:15	0.0		[]	9.18230035651e+17	[]	https://twitter.com/distantcities/status/918230035651325952	0.0	Those of us who were always puzzled why such good actresses as Asia Argento, Mira Sorvino, Ashley Judd etc, didn't work more ought to be 1/2	distantcities	0.059	0.839	0.101	0.296
686	2017-10-11 17:39:25	1.0		[]	9.18229577885e+17	[]	https://twitter.com/GrizzledOldGoat/status/918229577885016069	0.0	"The ""horrible suffering"" of Ashley Judd and Alysa Milano?"	GrizzledOldGoat wdilnot Niki1352	0.485	0.515	0.0	-0.765
687	2017-10-11 17:38:05	1.0		[]	9.18229240713e+17	[]	https://twitter.com/yates_ricky/status/918229240713269255	0.0	That man is truly sick. And Hollywood sang his praises for years making them sick as well, including Hillary, Obamas, Ashley Judd , etc. https://twitter.com/DailyCaller/status/918223682467659776…	yates_ricky DailyCaller	0.194	0.559	0.247	0.2023
688	2017-10-11 17:34:07	5.0		[]	9.18228243098e+17	[u'@AshleyJudd']	https://twitter.com/MannoiaChris/status/918228243098021888	2.0	Ashley Judd “Took one for the Team” in more ways than one. @AshleyJudd	MannoiaChris mikandynothem lilydaisyjoy	0.0	1.0	0.0	0.0
689	2017-10-11 17:33:30	57.0		['#EndRapeCulture']	9.18228086072e+17	[]	https://twitter.com/UltraViolet/status/918228086071660544	24.0	Thank you to Rose McGowan, Ashley Judd , Terry Crews and the countless other people coming forward with stories. We hear you. #EndRapeCulture	UltraViolet	0.0	0.894	0.106	0.3612
690	2017-10-11 17:30:53	1.0		[]	9.18227430397e+17	['@DailyMailCeleb']	https://twitter.com/Celebrity_VIP1/status/918227430397050882	0.0	@DailyMailCeleb: Ashley Judd 's mother Naomi praises her daughter http://ow.ly/rWcP50eynEu	Celebrity_VIP1	0.0	0.726	0.274	0.5267
691	2017-10-11 17:30:27	0.0		[]	9.18227320389e+17	[]	https://twitter.com/Golden_Chorizo/status/918227320388947969	0.0	I'm sorry but Ashley Judd is many wonderful things & to go along with that wonder is one of the most beautiful asses in all of Hollywood.	Golden_Chorizo ananavarro	0.033	0.657	0.31	0.9134
692	2017-10-11 17:26:33	0.0		[]	9.18226339824e+17	['@TomiLahren']	https://twitter.com/AjasutherlandM/status/918226339823607809	0.0	@TomiLahren Ashley Judd ! Does any remeber her speech at the Womens March in DC. What a joke.	AjasutherlandM	0.0	0.858	0.142	0.3595
693	2017-10-11 17:24:09	0.0		[]	9.18225735043e+17	[]	https://twitter.com/sebastianudo/status/918225735042682881	0.0	No viste un parecido entre Ashley Judd y una joven Sherilyn?	sebastianudo ArgTwinPeaks	0.196	0.804	0.0	-0.296
694	2017-10-11 17:23:57	0.0		[]	9.18225684803e+17	[]	https://twitter.com/TeeMichelle57/status/918225684803268609	0.0	Ashley Judd 's mother Naomi, 71, praises her daughter - Daily Mail https://apple.news/ASqOiBp4nRyevyL8ES6LrzQ…	TeeMichelle57	0.0	0.764	0.236	0.5267
695	2017-10-11 17:23:50	0.0		[]	9.18225652746e+17	[]	https://twitter.com/shanonvh/status/918225652746088448	0.0	Ashley Judd called out a TSA agent while still in airport for liking her dress, but not Harvey W	shanonvh seanhannity BillOReilly realDonaldTrump	0.0	0.896	0.104	0.2144
696	2017-10-11 17:23:02	0.0		[]	9.18225452569e+17	['@DailyMailCeleb']	https://twitter.com/johngosri/status/918225452568842241	0.0	Ashley Judd 's mother Naomi, 71, praises her daughter, she is a NASTY WOMAN! http://dailym.ai/2gcFXAs via @DailyMailCeleb	johngosri	0.21	0.636	0.154	-0.3016
697	2017-10-11 17:20:23	0.0		[]	9.18224785121e+17	[]	https://twitter.com/dementedforever/status/918224785120907264	0.0	Ashley Judd plays a lesbian waitress at a lesbian bar in this movie	dementedforever	0.0	0.833	0.167	0.25
698	2017-10-11 17:19:44	12.0		[]	9.18224623741e+17	[]	https://twitter.com/irishamrep1/status/918224623740874759	6.0	I think Ashley Judd is jumping on the $$$ wagon she's way too nasty for Weinstein	irishamrep1 xShamrock69 mikandynothem	0.205	0.795	0.0	-0.5574
699	2017-10-11 17:18:51	6.0		[]	9.18224398612e+17	[]	https://twitter.com/Uhtred1973/status/918224398611513345	3.0	Those neck tendons popping out are a sure sign of liberal lunacy! I used to love Ashley Judd	Uhtred1973 roswell2001	0.0	0.673	0.327	0.7777
700	2017-10-12 19:56:54	1.0		[]	9.18626562798e+17	[]	https://twitter.com/officecandy/status/918626562798440449	0.0	I really hope Jodi Kantor, Megan Twomey, Rose McGowan, and Ashley Judd are in there	officecandy Variety	0.0	0.803	0.197	0.4927
701	2017-10-12 19:56:40	0.0		[]	9.18626502514e+17	[]	https://twitter.com/MrCdubya/status/918626502513778690	1.0	So when are all those 'nice ladies' going to plan that march down Hollywood Blvd wearing those vagina suits? Hello Ashley Judd !!! https://twitter.com/dailycaller/status/918522790143254529…	MrCdubya DailyCaller	0.0	0.862	0.138	0.5684
702	2017-10-12 19:45:50	1.0		[]	9.18623778804e+17	[]	https://twitter.com/hattieb1911/status/918623778804035584	1.0	I haven't seen anything from pussy hat wearers Ashley Judd , Madonna, Cher? Is Hollywood finally being exposed? Thank you Rowan Farrow	hattieb1911	0.059	0.812	0.129	0.3736
703	2017-10-12 19:40:29	0.0		[]	9.1862243229e+17	[]	https://twitter.com/Phaiax/status/918622432289853441	0.0	Thanks for your courage Ashley Judd . You are an example for all honest women and men. I support you now and always.	Phaiax AshleyJudd nytimes	0.0	0.584	0.416	0.9022
704	2017-10-12 19:36:04	0.0		[]	9.18621318429e+17	[]	https://twitter.com/Star1063tsv/status/918621318429339648	0.0	About 30 women, including actresses Angelina Jolie, Ashley Judd and Gwyneth Paltrow, told The New York Times and... http://fb.me/VNqeqZKv	Star1063tsv	0.0	1.0	0.0	0.0
705	2017-10-12 19:34:45	0.0		['#NastyWoman']	9.18620988774e+17	[]	https://twitter.com/Fendervarius/status/918620988773937152	0.0	"""Women's March"" Will someone ask Ashley Judd why she didn't expose Harvey Weinstein at the last March? #NastyWoman"	Fendervarius	0.0	0.922	0.078	0.1139
706	2017-10-12 19:32:25	0.0		[]	9.18620401496e+17	[]	https://twitter.com/Toberonethal/status/918620401495707648	1.0	"Ashley Judd admits she's nasty and the Weinstein thing proves her dishonesty bias & hypocrisy
She thinks she is special but is not respected"	Toberonethal	0.242	0.636	0.122	-0.5237
707	2017-10-12 19:29:56	0.0		[]	9.18619774414e+17	[]	https://twitter.com/JohnMatthewsK/status/918619774413717504	1.0	Always knew Ashley Judd was a full raging bitch she has raised herself to full cunt status.	JohnMatthewsK	0.444	0.556	0.0	-0.886
708	2017-10-12 19:29:00	1.0		[]	9.18619541307e+17	[]	https://twitter.com/PhibianJay/status/918619541307117568	0.0	Respectfully, I can appreciate your position and empathize with it in part. However, Ashley Judd who admits victimhood made horrible comment	PhibianJay bdc63 JrcheneyJohn American1765	0.223	0.515	0.261	0.0258
709	2017-10-12 19:27:54	0.0		[]	9.18619266257e+17	[]	https://twitter.com/TioBWife/status/918619266257182721	0.0	Now we know why Ashley Judd is an AWESOME NASTY WOMAN, there I fixed it for you FAKE PROPHET	TioBWife DougSides POTUS	0.292	0.536	0.173	-0.516
710	2017-10-12 19:26:09	12.0		[]	9.18618823775e+17	[]	https://twitter.com/dreamoforgonon/status/918618823774932992	0.0	If it took someone w/the cachet of Ashley Judd to get this convo started, who is the comparable person? Who listens to gay sex workers?	dreamoforgonon dreamoforgonon	0.0	1.0	0.0	0.0
711	2017-10-12 19:18:35	0.0		[]	9.18616918831e+17	['@rosemcgowan']	https://twitter.com/Phaiax/status/918616918831050752	0.0	Thanks for your courage and openness. @rosemcgowan. I support Ashley Judd , you and all abused victims of Weinstein.	Phaiax rosemcgowan JeffBezos	0.201	0.396	0.403	0.6808
712	2017-10-12 19:17:35	3.0		[]	9.18616669811e+17	[]	https://twitter.com/theefefe/status/918616669811019776	0.0	I went looking for a specific Morgan Freeman and Ashley Judd movie but it doesn't exist. I guess I made it up. Hmm, should I write it..	theefefe theefefe	0.0	0.919	0.081	0.2144
713	2017-10-12 19:15:06	2.0		[]	9.18616044017e+17	[]	https://twitter.com/Lorenzo_Duartes/status/918616044016676864	0.0	Hahaha .. Ashley Judd talking about 'moral character'. Shut up, you disgusting fool. You knew about Weinstein years ago and did nothing. Stop faking outrage. - You could have saved other women from this criminal-pig, yet you chose not to. https://twitter.com/AshleyJudd/status/918197948093255681…	Lorenzo_Duartes AshleyJudd	0.12	0.627	0.253	0.7203
714	2017-10-12 19:12:37	1.0		[]	9.18615417161e+17	[]	https://twitter.com/theefefe/status/918615417161240577	0.0	ever just really need to watch every movie Morgan Freeman and Ashley Judd made together? samesies..	theefefe	0.0	0.847	0.153	0.4019
715	2017-10-12 19:05:42	1.0		[]	9.18613676495e+17	[]	https://twitter.com/WilliamStollar/status/918613676495486976	0.0	YEAH NOW!! After someone else did...and were was Ashley judd ? always on someone elses coat tails!! https://twitter.com/WhoWolfe/status/918613302854537216…	WilliamStollar WhoWolfe	0.0	0.796	0.204	0.625
716	2017-10-12 19:04:33	0.0		[]	9.18613386615e+17	['@jessebwatters']	https://twitter.com/smglass2/status/918613386614792197	0.0	@jessebwatters Jesse , just realized Ashley Judd didn't she say all those vulgar things about trump at women's rally and she got winsteined	smglass2	0.0	1.0	0.0	0.0
717	2017-10-12 19:04:04	0.0		[]	9.18613264967e+17	[]	https://twitter.com/namerankssn/status/918613264967307264	0.0	Why did Ashley Judd have so much to say about Trump but nary a public word about Weinstein? Why not mention him whilst in pussyhats?	namerankssn namerankssn aduke5 thehill	0.0	1.0	0.0	0.0
718	2017-10-12 19:01:21	0.0		[]	9.18612583208e+17	[]	https://twitter.com/RightWingCurry/status/918612583208194049	0.0	When Ashley Judd holds them responsible instead of letting others suffer abuse just so she can profit.	RightWingCurry phillippaonline drawandstrike	0.294	0.497	0.209	-0.5
719	2017-10-12 19:01:00	0.0		[]	9.18612496936e+17	[]	https://twitter.com/Kerridaniels12/status/918612496935682049	0.0	Why? Were Ashley Judd , Harvey Weinstein & Madonna too busy this year? They made such a splash last year, didn't they?	Kerridaniels12 Liz_Wheeler womensmarch	0.0	1.0	0.0	0.0
