Unnamed: 0	date	favorites	geo	hashtags	id	mentions	permalink	retweets	text	username	neg	neu	pos	compound
0	2017-10-05 19:57:30	0.0		[u'#Harvey', u'#Weinstein']	9.1608999873e+17	[]	https://twitter.com/ssoyuwis/status/916089998730022912	0.0	Two decades ago, the Hollywood producer #Harvey #Weinstein invited Ashley Judd to the … https://www.nytimes.com/2017/10/05/us/harvey-weinstein-harassment-allegations.html…	ssoyuwis	0.0	1.0	0.0	0.0
1	2017-10-05 19:57:08	0.0		[]	9.1608990599e+17	[]	https://twitter.com/Touch4Healing/status/916089905989566465	0.0	Harvey Weinstein Responds to Ashley Judd 's Sexual Harrassment Claims http://dlvr.it/PsgWZD	Touch4Healing	0.0	1.0	0.0	0.0
2	2017-10-05 19:56:45	0.0		[]	9.16089811429e+17	[]	https://twitter.com/Aaron885290571/status/916089811429072896	0.0	The hypocrisy of Ashley Judd . Calling trump a misogynistic predator while turning a blind eye and working with a real predator for decades.	Aaron885290571 RitaPanahi nytimes	0.124	0.876	0.0	-0.4019
3	2017-10-05 19:56:45	6.0		[]	9.16089809181e+17	[]	https://twitter.com/ona3pica/status/916089809180827648	0.0	I don't think highly of Harvey Weinstein, but I think he could easily make the case that Ashley Judd is FUCKIN' NUTS!	ona3pica MarkYoungTruth chuckwoolery POTUS	0.171	0.708	0.122	-0.3053
4	2017-10-05 19:56:16	0.0		[]	9.16089688834e+17	[]	https://twitter.com/SavetheUSNation/status/916089688833904640	0.0	"http://ift.tt/2fVhVtR "" Ashley Judd is bravely coming out against Weinstein --- Now that he's out of power and can't effect her career an…"	SavetheUSNation	0.0	0.864	0.136	0.5106
5	2017-10-05 19:56:01	0.0		[]	9.16089624082e+17	[]	https://twitter.com/JBNitefly224/status/916089624082223104	0.0	Harvey wanted Ashley Judd to watch him shower. That would gag a maggot.	JBNitefly224 DLoesch gehrig38	0.179	0.821	0.0	-0.34
6	2017-10-05 19:54:08	0.0		[]	9.16089150226e+17	[]	https://twitter.com/RemyKyd/status/916089150226423809	0.0	"""I know Ashley Judd is going through a tough time right now,"" As if that and the truth are mutually exclusive. https://twitter.com/DRUDGE_REPORT/status/916074407877009408…"	RemyKyd DRUDGE_REPORT	0.064	0.773	0.163	0.3182
7	2017-10-05 19:54:07	0.0		[u'#Celebrity']	9.16089145311e+17	[]	https://twitter.com/blogparser/status/916089145310744581	0.0	Ashley Judd Alleges That Harvey Weinstein Tried To Make Her Watch Him Shower Naked #Celebrity https://www.blogparser.com/ashley-judd-alleges-that-harvey-weinstein-tried-to-make-her-watch-him-shower-naked/…	blogparser	0.0	1.0	0.0	0.0
8	2017-10-05 19:53:49	1.0		[]	9.16089070799e+17	[]	https://twitter.com/DocbobLV/status/916089070798888960	0.0	"Of course Ashley Judd ,everyone wants her ... ""Not"".. Pathetic .. Hide news from her so she stops showing up to participate"	DocbobLV jaketapper AshleyJudd rosemcgowan	0.277	0.723	0.0	-0.7414
9	2017-10-05 19:52:28	0.0		[]	9.16088733002e+17	[]	https://twitter.com/bayou/status/916088733002108928	0.0	Only major celeb listed in article is Ashley Judd who has established career and no real fear now, others still afraid. My 2 cents	bayou JJK1013	0.205	0.795	0.0	-0.6597
10	2017-10-05 19:52:15	16.0		[]	9.16088676119e+17	[]	https://twitter.com/VEJA/status/916088676119171073	3.0	Ashley Judd acusa produtor Harvey Weinstein de assédio sexual http://wp.me/p7qnr3-9uc4	VEJA	0.0	1.0	0.0	0.0
11	2017-10-05 19:51:40	1836.0		[]	9.16088531554e+17	['@potus']	https://twitter.com/MarkYoungTruth/status/916088531554103297	1131.0	So Ashley Judd claims @potus election was like being raped but waited 20 years to accuse Harvey Weinstein?http://nydn.us/2xW3Jb0	MarkYoungTruth	0.23	0.69	0.08	-0.5023
12	2017-10-05 19:48:58	0.0		[]	9.16087852572e+17	[]	https://twitter.com/ColetteMoran/status/916087852571783169	0.0	Most sickening: Superfem Ashley Judd . Hinted but never named him before. Clearly covering herself. How many others suffered bec of silence?	ColetteMoran MelissaTweets	0.236	0.638	0.126	-0.476
13	2017-10-05 19:48:31	0.0		[]	9.16087739888e+17	[]	https://twitter.com/1066Live/status/916087739887603712	0.0	"Weinstein responds to ""decades of harassment"" alleged by Ashley Judd & others in NYTimes: ""I sincerely apologize""… https://twitter.com/i/web/status/916086869884010502…"	1066Live	0.162	0.694	0.144	-0.1027
14	2017-10-05 19:47:44	0.0		[]	9.16087538867e+17	[]	https://twitter.com/LightfootInHwd/status/916087538867154945	1.0	Harvey Weinstein Steps Down At Weinstein Co., Ashley Judd , Dozens Of Women Claim Abuse In… http://highlighthollywood.com/2017/10/harvey-weinstein-steps-down-at-weinstein-co-ashley-judd-dozens-of-women-claim-abuse-in-bombshell-nyt-report/…	LightfootInHwd	0.219	0.781	0.0	-0.6369
15	2017-10-05 19:47:42	0.0		[]	9.16087531125e+17	[]	https://twitter.com/Highlighthwd/status/916087531124510725	0.0	Harvey Weinstein Steps Down At Weinstein Co., Ashley Judd , Dozens Of Women Claim Abuse In… http://highlighthollywood.com/2017/10/harvey-weinstein-steps-down-at-weinstein-co-ashley-judd-dozens-of-women-claim-abuse-in-bombshell-nyt-report/…	Highlighthwd	0.219	0.781	0.0	-0.6369
16	2017-10-05 19:46:42	9.0		['#MAGA']	9.16087280175e+17	[]	https://twitter.com/ByeByeObama1/status/916087280175108097	11.0	"""Hurricane"" Harvey Weinstein seeks tutoring after damning report accuses him of sexually harassing Ashley Judd http://fxn.ws/2xkOOCN #MAGA"	ByeByeObama1	0.372	0.628	0.0	-0.8074
17	2017-10-05 19:46:35	1.0		[]	9.16087252208e+17	[]	https://twitter.com/blakehalltexas/status/916087252207525889	1.0	"Harvey Weinstein sexually harassing Ashley Judd .... hmmm dem sexually harasses a dem?
That can't be?  They are so tolerant..."	blakehalltexas	0.302	0.698	0.0	-0.8105
18	2017-10-05 19:45:37	0.0		[]	9.16087009089e+17	[]	https://twitter.com/dwilliams221/status/916087009088651264	0.0	Right hollyscum Ashley Judd is your hero. Got what she wanted by sleeping her way there and now throws out accusations.	dwilliams221 DonaldJTrumpJr	0.092	0.763	0.145	0.3182
19	2017-10-05 19:45:04	14.0		[]	9.16086869884e+17	['@NYTimes']	https://twitter.com/THR/status/916086869884010502	14.0	"Weinstein responds to ""decades of harassment"" alleged by Ashley Judd & others in @NYTimes: ""I sincerely apologize"" http://thr.cm/YR0oso"	THR	0.159	0.636	0.205	0.0
20	2017-10-05 19:44:35	0.0		[]	9.16086749038e+17	[]	https://twitter.com/bombshellalerts/status/916086749037780992	0.0	Ashley Judd Alleges That Harvey Weinstein Tried To Make Her Watch Him Shower Naked http://ift.tt/2hQTb6H	bombshellalerts	0.0	1.0	0.0	0.0
21	2017-10-05 19:43:45	0.0		[]	9.16086539277e+17	[]	https://twitter.com/jmotivator/status/916086539276509184	0.0	Geez.  No wonder Ashley Judd hates men so much if that was her experience.	jmotivator consequence	0.298	0.702	0.0	-0.6249
22	2017-10-05 19:42:47	0.0		[]	9.16086296758e+17	[]	https://twitter.com/myJuicePlusBiz/status/916086296757579777	0.0	but trump is a pig! Where are all the women marchers today, they should be incensed and standing by their vagina hat wearing Ashley Judd . https://twitter.com/KurtSchlichter/status/916076680271106048…	myJuicePlusBiz KurtSchlichter	0.152	0.848	0.0	-0.6476
23	2017-10-05 19:42:25	0.0		[]	9.16086201958e+17	[]	https://twitter.com/odhimself/status/916086201957920769	0.0	Ashley Judd —quiet on Weinstein for decades? But publicly humiliates a minimum-wage airport employee because he compliments her dress? Shame.	odhimself ali	0.226	0.662	0.112	-0.4137
24	2017-10-05 19:41:32	0.0		[]	9.16085980742e+17	[]	https://twitter.com/cikline/status/916085980741853185	0.0	No wonder Ashley Judd hates men so much...	cikline DBZDoll	0.459	0.541	0.0	-0.6249
25	2017-10-05 19:40:10	0.0		[]	9.16085638772e+17	[]	https://twitter.com/MekoStarr/status/916085638772019200	0.0	Harvey Weinstein Responds to Ashley Judd 's Sexual Harrassment Claims	MekoStarr	0.0	1.0	0.0	0.0
26	2017-10-05 19:37:49	0.0		[]	9.16085044406e+17	[]	https://twitter.com/BCharlote/status/916085044405587968	1.0	Ashley Judd is accusing Weinstein of sexual misconduct,  why didn't she mention this in her famous Nasty speech?	BCharlote Thomas1774Paine	0.249	0.751	0.0	-0.6486
27	2017-10-05 19:37:48	0.0		[]	9.16085039595e+17	[]	https://twitter.com/Dogstar_K9/status/916085039594721280	0.0	"""Harvey Weinstein"" and Ashley Judd ?

They deserve each other"	Dogstar_K9	0.0	1.0	0.0	0.0
28	2017-10-05 19:37:26	0.0		[]	9.16084947291e+17	[]	https://twitter.com/Msblowana/status/916084947290599424	0.0	Why?  He hasn't been charged with a crime, and Ashley Judd isn't exactly a great witness. Gloria Allred, anyone? https://twitter.com/XRIM/status/916083414511517696…	Msblowana	0.301	0.632	0.067	-0.7623
29	2017-10-05 19:37:16	3.0		[]	9.16084906254e+17	[]	https://twitter.com/ivegotthisK/status/916084906253602816	1.0	I wonder where Ashley Judd 's virtue was when she was wearing the pussy hat?	ivegotthisK KurtSchlichter jaketapper	0.0	0.823	0.177	0.4215
30	2017-10-05 19:36:35	0.0		[]	9.16084733578e+17	[]	https://twitter.com/MyK1smet/status/916084733578305536	0.0	No wonder Ashley Judd is a man hating witch - she had sex with the Hollywood pig, Harvey Weinstein.	MyK1smet	0.364	0.636	0.0	-0.7906
31	2017-10-05 19:36:29	4.0		[]	9.16084711101e+17	[]	https://twitter.com/Scream_Panico/status/916084711100993536	2.0	Jornal publicou reportagem em que Weinstein é acusado de assédio por pelo menos 8 mulheres, incluindo as atrizes Ashley Judd e Rose McGowan.	Scream_Panico	0.0	1.0	0.0	0.0
32	2017-10-05 19:36:26	0.0		[u'#utm_medium']	9.16084697209e+17	[u'@variety']	https://twitter.com/erikaherzog/status/916084697209372673	0.0	Ashley Judd Reveals Sexual Harassment by Studio Mogul (EXCLUSIVE) http://variety.com/2015/film/news/ashley-judd-sexual-harassment-studio-mogul-shower-1201610666/#utm_medium=social&utm_source=twitter&utm_campaign=social_bar&utm_content=bottom&utm_id=1201610666… via @variety	erikaherzog	0.241	0.759	0.0	-0.5423
33	2017-10-05 19:36:25	0.0		[]	9.1608469395e+17	[]	https://twitter.com/iconicfreedom1/status/916084693950328832	0.0	nice to know that ashley judd 's response to sexual harassment was NOT  to say anything but to try not to alienate weinstein. liberal abuser	iconicfreedom1	0.23	0.709	0.061	-0.7391
34	2017-10-05 19:36:00	0.0		[]	9.16084588413e+17	[]	https://twitter.com/FloMillet/status/916084588413378562	0.0	He's going after Ashley Judd in his latest statement	FloMillet rosemcgowan	0.0	1.0	0.0	0.0
35	2017-10-05 19:35:44	1.0		['#FoxNews']	9.16084523096e+17	[]	https://twitter.com/Washiepoo187/status/916084523095511042	3.0	Harvey Weinstein seeks 'tutoring' after damning report accuses him of sexually harassing Ashley Judd http://fxn.ws/2xkOOCN #FoxNews	Washiepoo187	0.39	0.61	0.0	-0.8074
36	2017-10-05 19:35:39	0.0		[]	9.16084499725e+17	[]	https://twitter.com/TopKekT1000/status/916084499724636161	0.0	But one accuser is Ashley Judd . And we all know she is completely sane and trustworthy... right? Right?	TopKekT1000 RitaPanahi	0.0	1.0	0.0	0.0
37	2017-10-05 19:33:08	0.0		[]	9.16083867928e+17	[]	https://twitter.com/Croatian_Fella/status/916083867928408064	0.0	I would love to see Ashley Judd , nastywoman in chief, lead a battalion of Hollywood's nastiest feminists as they take turns kicking Harvey Weinstein in the schlong until his gender changes.	Croatian_Fella	0.098	0.78	0.121	0.2023
38	2017-10-05 19:32:54	0.0		[]	9.16083806004e+17	['@rushlimbaugh']	https://twitter.com/AvanteHandsFree/status/916083806003752960	0.0	@rushlimbaugh Why did you air that vile, disgusting clip from Ashley Judd today? Upsetting. Didn't need to hear that again!	AvanteHandsFree	0.391	0.609	0.0	-0.8977
39	2017-10-05 19:32:04	0.0		[]	9.16083599749e+17	[]	https://twitter.com/1037ChuckFM/status/916083599748812800	0.0	Ashley Judd accuses Hollywood producer Harvey Weinstein of sexual harassment https://trib.al/S2RMyzv	1037ChuckFM	0.396	0.604	0.0	-0.7096
40	2017-10-05 19:31:24	1.0		[]	9.16083431998e+17	[]	https://twitter.com/L_Hoff/status/916083431997554688	0.0	He legit tries to dispute the Ashley Judd claim by saying they were later photographed at a party together and she was smiling https://twitter.com/kpfallon/status/916081020167913473…	L_Hoff	0.095	0.704	0.201	0.4588
41	2017-10-05 19:31:04	0.0		[]	9.16083348426e+17	[]	https://twitter.com/Richard_Carroll/status/916083348426055680	0.0	Also: ‘I was so sad to read in Ashley Judd ’s book that she was sexually abused as a child and suffers from depression’ *wink* *wink*	Richard_Carroll Richard_Carroll	0.321	0.679	0.0	-0.8858
42	2017-10-05 19:30:42	0.0		[]	9.16083252934e+17	[]	https://twitter.com/nuzombie4/status/916083252934463488	1.0	"IF ASHLEY JUDD KEEPS WEARING THAT ""PINK CAP""....THAT'LL MAKE JUST ANOTHER CAVITY TO SEARCH!!!THAT ""PINK CAP"" IS JUST....FULL OF SHIT!!!"	nuzombie4 comermd vannsmole HillaryClinton	0.201	0.799	0.0	-0.6973
43	2017-10-05 19:30:21	1.0		[]	9.16083164972e+17	[]	https://twitter.com/SoftMediaClub/status/916083164971503623	0.0	Harvey Weinstein sexual harassment report reveals multiple settlements, incident with Ashley Judd http://allsoftmedia.altervista.org/harvey-weinstein-sexual-harassment-report-reveals-multiple-settlements-incident-with-ashley-judd/…	SoftMediaClub	0.226	0.774	0.0	-0.5423
44	2017-10-05 19:30:07	0.0		[]	9.16083107195e+17	[]	https://twitter.com/Msblowana/status/916083107194916864	0.0	Ashley Judd sees men sexually assaulting her everywhere.  She is a target (eyeroll.) https://twitter.com/LibraTarian/status/916082700808794112…	Msblowana LibraTarian	0.216	0.784	0.0	-0.5106
45	2017-10-05 19:29:54	1.0		[]	9.16083053826e+17	[]	https://twitter.com/Richard_Carroll/status/916083053826420737	0.0	Also: ‘If I sexually harassed Ashley Judd , why was she photographed smiling next to me, and why did she work for me again 15 years later?’	Richard_Carroll Richard_Carroll	0.119	0.78	0.102	-0.128
46	2017-10-05 19:28:57	1.0		[]	9.16082812247e+17	[]	https://twitter.com/KIRO7Seattle/status/916082812247212032	1.0	Ashley Judd accuses Hollywood producer Harvey Weinstein of sexual harassment http://kiro.tv/2xWKV8V	KIRO7Seattle	0.396	0.604	0.0	-0.7096
47	2017-10-05 19:28:19	173.0		[]	9.16082654114e+17	[]	https://twitter.com/ProfBlacktruth/status/916082654113562624	100.0	"Women like Ashley Judd have complained about Harvey Weinstein for decades. So will he get the Cosby treatment?
https://www.nytimes.com/2017/10/05/us/harvey-weinstein-harassment-allegations.html…"	ProfBlacktruth	0.122	0.766	0.113	-0.0516
48	2017-10-05 19:27:48	37.0		[]	9.16082522828e+17	[]	https://twitter.com/RoArquette/status/916082522827628544	3.0	Proud of Ashley Judd !!	RoArquette	0.0	0.521	0.479	0.5696
49	2017-10-05 19:26:48	0.0		[]	9.160822713e+17	[]	https://twitter.com/Luca_Forzin/status/916082271299530752	0.0	Harvey Weinstein Responds to Ashley Judd 's Sexual Harrassment Claims http://ift.tt/2gg8nX6	Luca_Forzin	0.0	1.0	0.0	0.0
50	2017-10-05 19:26:30	1.0		[]	9.16082195467e+17	[]	https://twitter.com/eddiemaughon/status/916082195466522624	0.0	Everything about him exudes sleaze! No wonder Ashley Judd acts as crazy as she does.	eddiemaughon Janetmas HarveyWeinstein	0.273	0.727	0.0	-0.5983
51	2017-10-05 19:26:28	1.0		[]	9.16082191058e+17	[]	https://twitter.com/validthought/status/916082191058165761	0.0	At least we know why Ashley Judd got famous in the first place. Now she kicks the ladder down behind her.	validthought MarkYoungTruth chuckwoolery	0.0	1.0	0.0	0.0
52	2017-10-05 19:26:21	2.0		[]	9.16082159152e+17	[]	https://twitter.com/kelcielogan/status/916082159152181248	0.0	idc if you think ashley judd is the worst person in the world - as a woman, you should not discredit her story of harassment.	kelcielogan kelcielogan	0.266	0.734	0.0	-0.8225
53	2017-10-05 19:26:17	2.0		[]	9.16082143994e+17	[u'@thr']	https://twitter.com/prv87/status/916082143993966593	2.0	"Harvey Weinstein's ""Decades of Harassment"" Alleged by Ashley Judd and Others in N.Y. Times Exposé http://www.hollywoodreporter.com/news/harvey-weinsteins-decades-harassment-alleged-by-ashley-judd-others-ny-times-expose-1046114… via @thr"	prv87	0.171	0.829	0.0	-0.5423
54	2017-10-05 19:26:15	0.0		[]	9.16082134062e+17	[]	https://twitter.com/TrendStyleDaily/status/916082134061854722	0.0	"Ashley Judd Alleges That Harvey Weinstein Tried To Make Her Watch Him Shower Naked

Brave actress Ashley Judd has … http://hollywoodlife.com/2017/10/05/ashley-judd-harvey-weinstein-sexual-harassment-watch-him-shower-naked/…"	TrendStyleDaily	0.0	0.855	0.145	0.5267
55	2017-10-05 19:26:13	0.0		[]	9.16082126965e+17	[]	https://twitter.com/BasedTrumpProud/status/916082126964932609	0.0	WOW! When Ashley JUDD calls you FILTHY thats FILTHY ON STEROIDS!  This is going to be fun! WINNING!! https://twitter.com/Luca_Forzin/status/916081442815467520…	BasedTrumpProud Luca_Forzin	0.0	0.549	0.451	0.9341
56	2017-10-05 19:26:04	0.0		[]	9.16082090219e+17	[]	https://twitter.com/Gram247/status/916082090218725376	0.0	I wonder if Ashley Judd called him a Nasty man	Gram247 TIME hale4jesus	0.34	0.66	0.0	-0.5574
57	2017-10-05 19:24:15	1.0		[]	9.1608163236e+17	[]	https://twitter.com/Stephanie43640G/status/916081632360189962	0.0	"Wow, not surprised! & Ashley Judd offended by a statement, ""grab her by the pussy."" Hypocrite much ashley? Hollyweird 4 ya"	Stephanie43640G Deplorablemoo Leannsm19342378 ABC7	0.161	0.659	0.18	0.3455
58	2017-10-05 19:23:58	0.0		[]	9.16081557815e+17	[u'@FoxNews']	https://twitter.com/lftbronson/status/916081557814771712	0.0	Harvey Weinstein seeks 'tutoring' after damning report accuses him of sexually harassing Ashley Judd http://www.foxnews.com/entertainment/2017/10/05/harvey-weinstein-seeks-tutoring-after-damning-report-accuses-him-sexually-harassing-ashley-judd.html… via @FoxNews	lftbronson	0.372	0.628	0.0	-0.8074
59	2017-10-05 19:23:36	0.0		[]	9.16081467432e+17	['@ambertamblyn']	https://twitter.com/angmarsrealm/status/916081467431714816	0.0	@ambertamblyn for this ignorant person what happened to Ashley Judd ?	angmarsrealm	0.209	0.791	0.0	-0.3346
60	2017-10-05 19:23:30	0.0		[]	9.16081442815e+17	[]	https://twitter.com/Luca_Forzin/status/916081442815467520	0.0	Brave actress Ashley Judd has come forward to allege that film mogul Harvey Weinstein sexually harassed her -- inc… http://ift.tt/2xXXMry	Luca_Forzin	0.141	0.723	0.137	-0.0258
61	2017-10-05 19:23:02	1.0		[]	9.16081326398e+17	[]	https://twitter.com/throwoutthebums/status/916081326398226432	0.0	I don't know how seriously I would take Ashley Judd . She recently went on a psycho rant cause some gu... https://gab.ai/Mcarr/posts/13015489…	throwoutthebums	0.12	0.803	0.076	-0.222
62	2017-10-05 19:23:00	1.0		[]	9.16081315573e+17	[]	https://twitter.com/cathy_crawley/status/916081315572629504	0.0	Ashley Judd has done a great thing for other women in speaking out about this.	cathy_crawley RitaPanahi nytimes	0.0	0.76	0.24	0.6249
63	2017-10-05 19:22:51	1.0		[]	9.16081278059e+17	[]	https://twitter.com/JoeOrtiz387/status/916081278058762240	1.0	"re: Weinstein scandal;
Dems & MSM say "" Move along, nothing to see here"". Did you hear the Ashley Judd version & his involvment with her?"	JoeOrtiz387 mcsorianoaz Cernovich	0.116	0.884	0.0	-0.4404
64	2017-10-05 19:22:25	0.0		[]	9.16081169129e+17	[u'@JustJared']	https://twitter.com/GinaLawriw/status/916081169128722434	0.0	Harvey Weinstein Responds to Ashley Judd 's Sexual Harrassment Claims http://www.justjared.com/2017/10/05/harvey-weinstein-responds-to-ashley-judds-sexual-harrassment-claims/… via @JustJared	GinaLawriw	0.0	1.0	0.0	0.0
65	2017-10-05 19:21:09	0.0		[u'#2016_Presidential_Race', u'#Big_Government', u'#Big_Hollywood', u'#Ashley_Judd']	9.16080849556e+17	[]	https://twitter.com/ROSHAMB0/status/916080849556082688	0.0	Hollywood Titan, Hillary Donor Harvey… http://dlvr.it/PsgGtJ #2016_Presidential_Race #Big_Government #Big_Hollywood #Ashley_Judd	ROSHAMB0	0.0	1.0	0.0	0.0
66	2017-10-05 19:20:43	0.0		[]	9.16080740345e+17	[]	https://twitter.com/h__7/status/916080740344958977	0.0	فضائح كبيره للمخرج المعروف هارڤي واينستين من ضمنها التحرش لسنوات طويله بـ Ashley Judd ، خبر يهز هوليوود! https://www.nytimes.com/2017/10/05/us/harvey-weinstein-harassment-allegations.html?_r=0…	h__7	0.0	1.0	0.0	0.0
67	2017-10-05 19:20:12	2.0		[]	9.16080611416e+17	[]	https://twitter.com/SteveHusker/status/916080611416248321	0.0	You mean like Ashley Judd ?	SteveHusker TruckerBobS HarveyWeinstein	0.0	0.615	0.385	0.3612
68	2017-10-05 19:19:54	0.0		[]	9.16080538402e+17	[]	https://twitter.com/DanRiehl/status/916080538401767426	1.0	Weinstein continued, “But she changed her story when giving it to the Times. I know Ashley Judd is going through a tough time right now,	DanRiehl	0.06	0.843	0.096	0.2263
69	2017-10-05 19:19:29	0.0		[]	9.16080432739e+17	[]	https://twitter.com/OccamsBeard/status/916080432738738176	0.0	Harvey Weinstein Accused of Nearly 30 Years of Alleged Sexual Misconduct After Ashley Judd and More Speak Out http://eonli.ne/2wzEnM3	OccamsBeard	0.109	0.891	0.0	-0.296
70	2017-10-05 19:18:56	0.0		[]	9.16080291479e+17	[]	https://twitter.com/robertDay16/status/916080291478990854	0.0	Except......it's Ashley Judd alias ( Nasty Woman) who told the story.	robertDay16 jaketapper AshleyJudd	0.286	0.714	0.0	-0.5574
71	2017-10-05 19:18:45	3.0		[]	9.16080245056e+17	[]	https://twitter.com/annieone3/status/916080245056376837	0.0	Curious how Ashley Judd managed to keep her big mouth shut about this for so long.  What a fraud!!!!	annieone3 Cernovich	0.0	0.831	0.169	0.5374
72	2017-10-05 19:18:00	1.0		[]	9.16080057797e+17	[]	https://twitter.com/chareyl/status/916080057797316609	0.0	I want to see a freaking woman’s march with Ashley Judd and Madonna yelling at the top of their lungs...Hollywood hypocrisy at its finest!	chareyl Cernovich jimmykimmel	0.111	0.754	0.135	-0.2481
73	2017-10-05 19:17:57	3.0		[]	9.1608004662e+17	[]	https://twitter.com/Oil_Ranger/status/916080046619742213	0.0	Ironically, Ashley Judd is one of the accusers!...might be believable if she wasn't such a screeching harpy	Oil_Ranger ChristiChat	0.0	1.0	0.0	0.0
74	2017-10-05 19:17:23	1.0		[]	9.16079902977e+17	[]	https://twitter.com/Heavens_Angel26/status/916079902977339392	0.0	"I thought Ashley Judd liked being a nasty woman?

https://www.youtube.com/watch?v=ffb_5X59_DA…"	Heavens_Angel26 neontaster	0.31	0.47	0.219	-0.2869
75	2017-10-05 19:17:12	4.0		[]	9.16079855548e+17	[]	https://twitter.com/JustJared/status/916079855548157952	1.0	Harvey Weinstein is speaking out against the sexual harassment claims Ashley Judd made against him: http://www.justjared.com/2017/10/05/harvey-weinstein-responds-to-ashley-judds-sexual-harrassment-claims/…	JustJared	0.189	0.811	0.0	-0.5423
76	2017-10-05 19:16:43	0.0		[u'#Harvey', u'#Weinstein']	9.16079734329e+17	[]	https://twitter.com/rnuviletu/status/916079734328569857	0.0	Two decades ago, the Hollywood producer #Harvey #Weinstein invited Ashley Judd to the … https://www.nytimes.com/2017/10/05/us/harvey-weinstein-harassment-allegations.html…	rnuviletu	0.0	1.0	0.0	0.0
77	2017-10-05 19:16:40	0.0		[]	9.16079724673e+17	[]	https://twitter.com/mrclean1963/status/916079724673294338	0.0	Ashley Judd fake actress bimbo eruptions	mrclean1963	0.383	0.617	0.0	-0.4767
78	2017-10-05 19:15:26	0.0		[]	9.16079411669e+17	[]	https://twitter.com/annieone3/status/916079411669192706	0.0	Ashley Judd managed to keep HER BIG MOUTH shut about this for decades! Another fraud!	annieone3 annieone3	0.238	0.762	0.0	-0.658
79	2017-10-05 19:15:05	0.0		[]	9.16079322804e+17	[]	https://twitter.com/GayleneRias/status/916079322804264960	0.0	Harvey Weinstein Accused of Nearly 30 Years of Alleged Sexual Misconduct After Ashley Judd and More Speak Out:… http://dlvr.it/PsgCxf	GayleneRias	0.109	0.891	0.0	-0.296
80	2017-10-05 19:14:39	0.0		[]	9.16079216311e+17	[]	https://twitter.com/DoubleXMag/status/916079216311095297	1.0	Ashley Judd and others accuse Harvey Weinstein of sexual harassment in a New York Times exposé: http://www.slate.com/blogs/browbeat/2017/10/05/harvey_weinstein_accused_of_sexual_harassment_by_ashley_judd_more.html…	DoubleXMag	0.275	0.725	0.0	-0.6486
81	2017-10-05 19:10:50	6.0		[]	9.16078253953e+17	[]	https://twitter.com/keddren/status/916078253953179649	0.0	"""In a year from now I am going to reach out to [ Ashley Judd ].”

Uh, maybe don't."	keddren joshtpm	0.0	0.932	0.068	0.0258
82	2017-10-05 19:10:29	4.0		[]	9.16078168511e+17	['@BlueSea1964', '@HillaryClinton']	https://twitter.com/gingerdxn/status/916078168510992384	1.0	"@BlueSea1964 @HillaryClinton Ashley Judd , ""NASTY WOMAN"" per her own words."	gingerdxn comermd	0.325	0.675	0.0	-0.6523
83	2017-10-05 19:10:11	0.0		[]	9.16078092271e+17	[]	https://twitter.com/YourGACountry/status/916078092271128578	0.0	Ashley Judd accuses Hollywood producer Harvey Weinstein of sexual harassment https://trib.al/tOfEXIa	YourGACountry	0.396	0.604	0.0	-0.7096
84	2017-10-05 19:10:10	1.0		[]	9.16078089004e+17	[]	https://twitter.com/slcw57/status/916078089003847681	0.0	"aren't you a ""nasty' woman anyway ashley judd ???"	slcw57 nytimes thegreasygranny	0.0	1.0	0.0	0.0
85	2017-10-05 19:09:31	2.0		[]	9.1607792163e+17	[]	https://twitter.com/jdelreal/status/916077921630081024	2.0	Ashley Judd is one of many, many women accusing Weinstein of inappropriate sexual harassment *on the record* https://nyti.ms/2xVPfVW	jdelreal	0.245	0.755	0.0	-0.6369
86	2017-10-05 19:08:39	1.0		[]	9.16077705112e+17	[]	https://twitter.com/VialCecilia/status/916077705111752705	0.0	Harvey Weinstein seeks 'tutoring' after damning report accuses him of sexually harassing Ashley Judd http://ift.tt/2y47aMv	VialCecilia	0.409	0.591	0.0	-0.8074
