Unnamed: 0	date	favorites	geo	hashtags	id	mentions	permalink	retweets	text	username	neg	neu	pos	compound
1261	2017-10-17 11:16:48	0.0		[]	9.20307615003e+17	['@KySportsRadio', '@ryanlemond', '@ShannonTheDude']	https://twitter.com/1STDOWNEVENTS/status/920307615002976256	0.0	@KySportsRadio @ryanlemond @ShannonTheDude Cal, Ashley Judd , Papa Johns, Mitch McConnell, Bobby Petrino	1STDOWNEVENTS	0.0	1.0	0.0	0.0
1262	2017-10-17 11:16:39	0.0		[]	9.20307577233e+17	[]	https://twitter.com/luisgudes/status/920307577233211392	0.0	Harvey Weinstein accused of sexual harassment by Ashley Judd http://nydn.us/2xW3Jb0	luisgudes	0.416	0.584	0.0	-0.6908
1263	2017-10-17 11:15:40	0.0		[]	9.20307327572e+17	['@KySportsRadio']	https://twitter.com/Markmp11/status/920307327571513350	0.0	@KySportsRadio Ashley Judd ? Unfortunate but maybe	Markmp11	0.286	0.714	0.0	-0.25
1264	2017-10-17 11:15:17	0.0		[]	9.20307231581e+17	['@ShannonTheDude']	https://twitter.com/bryanburkey1/status/920307231580704768	0.0	@ShannonTheDude ashley judd , johnny depp ,john short	bryanburkey1	0.0	1.0	0.0	0.0
1265	2017-10-17 11:13:39	0.0		[]	9.20306821617e+17	['@KySportsRadio']	https://twitter.com/bryanburkey1/status/920306821616807937	0.0	@KySportsRadio ashley judd johnny depp	bryanburkey1	0.0	1.0	0.0	0.0
1266	2017-10-17 11:06:40	1.0		[]	9.20305062597e+17	[]	https://twitter.com/kpose26/status/920305062597025792	0.0	Now we know why Ashley Judd has so many problems.	kpose26 VivaLaAmesX	0.249	0.751	0.0	-0.4549
1267	2017-10-17 11:01:27	2.0		[]	9.2030375001e+17	[]	https://twitter.com/THEJeremyinPDX/status/920303750010388487	0.0	Ashley Judd used to be a crush of mine but man she's a dumb, hypocritical, bitch.	THEJeremyinPDX SarahT_in_Prov	0.599	0.401	0.0	-0.9428
1268	2017-10-17 10:40:38	1.0		[]	9.20298514307e+17	[u'@BenDouglasson']	https://twitter.com/uncle2u/status/920298514306994176	0.0	@BenDouglasson where is Ashley Judd ? https://twitter.com/uncle2u/status/920295956494635010…	uncle2u uncle2u	0.0	1.0	0.0	0.0
1269	2017-10-17 10:36:27	1.0		[]	9.20297460941e+17	[]	https://twitter.com/micke_lindquist/status/920297460941148160	0.0	Ashley Judd , en av kvinnorna som pekat ut Weinstein.	micke_lindquist Hysterisk_kvinn Ninnis_tankar	0.0	1.0	0.0	0.0
1270	2017-10-17 10:30:28	3.0		['#MenWhoCheat']	9.20295956495e+17	['@BruceWolfChi']	https://twitter.com/uncle2u/status/920295956494635010	0.0	@BruceWolfChi Ashley Judd has been silent on Louisville firing her favorite basketball coach #MenWhoCheat	uncle2u	0.138	0.69	0.172	0.1531
1271	2017-10-17 10:30:03	0.0		[]	9.20295850253e+17	[]	https://twitter.com/RCR52/status/920295850252828673	0.0	The way I see it is u have women like Ashley Judd telling us how to be a Strong Woman, but in reality she is a Hypocrit	RCR52 Uncertaintist NetworkJunkyz FoxNews	0.0	0.843	0.157	0.4404
1272	2017-10-17 10:23:20	0.0		[]	9.20294157541e+17	[]	https://twitter.com/JonesWarrenjon8/status/920294157540888576	0.0	Dario Franchitti Doppledanger! I believe Ashley Judd may be available .	JonesWarrenjon8 nascarcasm tisjustjulia Blaney	0.0	1.0	0.0	0.0
1273	2017-10-17 10:18:24	0.0		[]	9.20292919433e+17	[]	https://twitter.com/Gutofirst_/status/920292919432613888	0.0	“Os relatos de colegas como Angelina Jolie, Gwyneth Paltrow e Ashley Judd , porém, fizeram com que ela tivesse... http://fb.me/6zcgsur6Y	Gutofirst_	0.0	1.0	0.0	0.0
1274	2017-10-17 10:13:08	0.0		[]	9.20291594091e+17	[]	https://twitter.com/wanna_feel_old/status/920291594091319298	0.0	Wanna feel old? Ashley Judd is turning 18 today	wanna_feel_old	0.0	1.0	0.0	0.0
1275	2017-10-17 10:05:35	22.0		[]	9.20289691589e+17	[]	https://twitter.com/womensmediacntr/status/920289691588538368	8.0	Ashley Judd to be celebrated with Speaking Truth to Power honor at Women's Media Awards http://fw.to/480fWYf	womensmediacntr	0.0	0.496	0.504	0.9042
1276	2017-10-17 10:00:44	1.0		[]	9.20288472048e+17	[]	https://twitter.com/GameOfTrumpster/status/920288472048345088	0.0	And we know now that DiNero was a pimp for Harvey Weinstein at his restaurant, the Tribecca Grill, Ashley Judd was screwed literally by H.W.	GameOfTrumpster WhoWolfe	0.122	0.878	0.0	-0.4939
1277	2017-10-17 09:50:16	0.0		[]	9.20285836017e+17	['@pagesix']	https://twitter.com/Silver2219/status/920285836016537601	0.0	Ashley Judd where is your outrage with Hollywood rampant sexual harassment? Or are you just a HATER?   http://pge.sx/2wHFRne via @pagesix	Silver2219	0.401	0.599	0.0	-0.8932
1278	2017-10-17 09:29:27	0.0		[]	9.20280600946e+17	[]	https://twitter.com/udchuck/status/920280600946323456	0.0	Still waiting for the condemnation of Johnny Depp, Madonna & Ashley Judd - all who have promoted violence against POTUS.	udchuck ChelseaClinton IngrahamAngle	0.307	0.584	0.109	-0.7269
1279	2017-10-17 09:25:06	2.0		[]	9.20279505059e+17	[]	https://twitter.com/Paminlaok/status/920279505058504706	0.0	I’m guilty of expecting Ashley Judd to have spoken up on Weinstein, but only Judd. Based on her very outspoken stance during women’s march.	Paminlaok ThomasWictor	0.076	0.924	0.0	-0.2263
1280	2017-10-17 09:20:48	48.0		[u'#']	9.20278424216e+17	[]	https://twitter.com/WeirdNPissdOff/status/920278424215724032	12.0	Ashley Judd lost her shit when some guy smiled at her & Brie Larson said being asked for her # was harassment https://twitter.com/fyeahmfabello/status/919657989241483265…	WeirdNPissdOff fyeahmfabello	0.314	0.569	0.117	-0.7096
1281	2017-10-17 09:04:34	2.0		[]	9.20274337886e+17	[]	https://twitter.com/ReiserWilliam/status/920274337885802496	0.0	Republican women command respect without wearing Pussy hats & Vagina costumes yelling in public that they are Nasty Women-Like Ashley Judd .	ReiserWilliam regkl BeSmarter15	0.146	0.729	0.126	-0.128
1282	2017-10-17 09:01:32	2.0		[]	9.20273573528e+17	[]	https://twitter.com/camillalong/status/920273573528440833	1.0	""" Ashley Judd , who I'd give anything to go to bed with, should be ashamed of herself..."""	camillalong HadleyFreeman IsabelHardman	0.171	0.829	0.0	-0.4767
1283	2017-10-17 08:48:10	1.0		[]	9.20270208124e+17	[]	https://twitter.com/FraserCharmagne/status/920270208123719681	0.0	Let me get this straight, Ashley Judd got on stage all full of piss & vinegar over Trump but NEVER said 1 word about Harvey! Such BULL SHIT!	FraserCharmagne	0.256	0.697	0.047	-0.8347
1284	2017-10-17 08:31:52	1.0		[]	9.20266109425e+17	[]	https://twitter.com/Reveille_VA/status/920266109424717824	0.0	"Weird, you sound just like Ashley Judd w/ her Pussyhat, ""standing up"" against Trump, but not Weinstein who ACTUALLY raped her"	Reveille_VA krassenstein impeach_d_trump ABCNewsRadio	0.282	0.655	0.064	-0.7906
1285	2017-10-17 08:27:42	5.0		[]	9.20265057594e+17	[]	https://twitter.com/MichelleGieseke/status/920265057593827329	1.0	HRC, Ashley Judd , Rosie, Madonna, Lily, Jane, Cher should start their own island somewhere else far away from America. So disrespectful!	MichelleGieseke FoxNews Janefonda	0.0	1.0	0.0	0.0
1286	2017-10-17 08:16:11	0.0		[]	9.20262159233e+17	[]	https://twitter.com/Maggie100862/status/920262159233318912	0.0	DISGUSTING BEYOND WORDS. WHO IS LOOKING OUT FOR THESE FEMALES LISA BLOOM, MADONNA AND ASHLEY JUDD ? NOT YOU BITCHES THAT'S FOR SURE!!! https://twitter.com/OkKelly22/status/913143283945222144…	Maggie100862 OkKelly22	0.13	0.63	0.239	0.5368
1287	2017-10-17 08:06:48	0.0		[]	9.20259798323e+17	[]	https://twitter.com/efeekonadnerb/status/920259798322597888	0.0	how come the streets in Hollywood are not filled with pussy hat  people like Ashley Judd talking about how she’s nasty woman or Madonna	efeekonadnerb InFlHell CBSNews	0.128	0.783	0.089	-0.2732
1288	2017-10-17 07:59:36	0.0		[]	9.20257986714e+17	[]	https://twitter.com/CPMPolls/status/920257986714411009	0.0	ashley judd is the most bitter woman i have ever seen	CPMPolls marlacbeard	0.256	0.744	0.0	-0.4754
1289	2017-10-17 07:57:25	0.0		[]	9.20257439903e+17	[]	https://twitter.com/RedPillReport/status/920257439903002625	0.0	"""Yes, Ashley Judd ...go for it. You'll still look so natural. No one will know!"" -Your friends- Carrot Top, Mickey Roark, and Joan VanArk"	RedPillReport	0.08	0.647	0.273	0.7145
1290	2017-10-17 07:46:23	0.0		[]	9.20254661617e+17	[]	https://twitter.com/sharylanne/status/920254661617180672	0.0	She probably didn't. Look at her. Weinstein would need an endless supply of paper bags. And Ashley Judd , I know first hand she gives it away	sharylanne carolehers	0.0	0.882	0.118	0.4939
1291	2017-10-17 07:46:02	50.0		['#tcot']	9.20254574384e+17	[]	https://twitter.com/jeanniology/status/920254574384107520	15.0	How come when leftist women like Ashley Judd were ranting about Trump being vile 'p**sy grabber' they never mentioned Weinstein? #tcot	jeanniology	0.16	0.742	0.098	-0.3818
1292	2017-10-17 07:35:45	0.0		[]	9.2025198675e+17	[]	https://twitter.com/AbuelaStevens/status/920251986750078976	0.0	CAN YOU SAY.....Hypocrites Ashley Judd Angelina Jolie	AbuelaStevens	0.0	1.0	0.0	0.0
1293	2017-10-17 07:11:11	0.0		[]	9.20245804816e+17	[]	https://twitter.com/MelodyPearce1/status/920245804815802368	0.0	She needs to go to Hollywood and have a March with Nasty Woman Ashley Judd , Jane , Rosie... Hell, all the Phony Sick Entertainers!!	MelodyPearce1 Madonna	0.377	0.561	0.062	-0.9018
1294	2017-10-17 06:47:28	0.0		['#metoo']	9.20239833402e+17	[]	https://twitter.com/lauriejb92/status/920239833401974784	0.0	Exhibit 1)- Ashley Judd offended a man in an airport said her dress was nice.  NOT sexual harassment, NOT #metoo .  NOT sexual abuse (2/4)	lauriejb92	0.067	0.633	0.3	0.7916
1295	2017-10-17 06:35:36	0.0		[]	9.20236850115e+17	[u'@rebzamhttp']	https://twitter.com/jadbeavis/status/920236850115174400	0.0	In praise of Ashley Judd , Lucy DeCoutere and other sacrificial lambs, by @rebzamhttp://m.huffingtonpost.ca/rebecca-zamon/in-praise-of-ashley-judd-lucy-decoutere-and-other-sacrificial-lambs_a_23239865/?ncid=fcbklnkcahpmg00000001…	jadbeavis	0.0	0.769	0.231	0.5574
1296	2017-10-17 05:32:33	2.0		[]	9.20220979334e+17	['@MailOnline']	https://twitter.com/PastorDScot/status/920220979334471680	0.0	Stars go silent and offer no public support for Ashley Judd http://dailym.ai/2fXdkar via @MailOnline	PastorDScot	0.13	0.71	0.16	0.128
1297	2017-10-17 05:31:40	0.0		[]	9.20220761004e+17	[]	https://twitter.com/LanieDaPooh/status/920220761004101632	0.0	Ashley Judd	LanieDaPooh LanieDaPooh AntifaMidwest	0.0	1.0	0.0	0.0
1298	2017-10-17 03:29:02	0.0		['#HarveyWeinstein', '#MeToo']	9.2018989773e+17	[]	https://twitter.com/MetropolisGal/status/920189897729863680	0.0	"I wasn't ""assuming"". Now you have your proof. Stop harassing incest survivor, Ashley Judd . #HarveyWeinstein #MeToo"	MetropolisGal ChippyCham	0.282	0.594	0.124	-0.4939
1299	2017-10-17 03:22:21	0.0		[u'#Trump', u'#MeToo', u'#HarveyWeinstein']	9.20188214023e+17	[]	https://twitter.com/MetropolisGal/status/920188214022955009	0.0	"The ""Christian compassion"" of #Trump  supporters? Blasting incest survivor ( Ashley Judd )? #MeToo #HarveyWeinstein  https://twitter.com/ChippyCham/status/920069053854765057…"	MetropolisGal	0.0	0.578	0.422	0.8299
1300	2017-10-18 19:33:59	0.0		[]	9.20795121071e+17	[]	https://twitter.com/Rick77Rp/status/920795121070641152	0.0	Dickie V Is A Dirty Old Man Ashley Judd Daddy	Rick77Rp MemphisMan76 CBSSportsCBB DickieV	0.293	0.707	0.0	-0.4404
1301	2017-10-18 19:33:18	7.0		[]	9.20794950962e+17	[]	https://twitter.com/realitytvgypsy/status/920794950962372608	0.0	I am assuming Ashley Judd was there .... nasty!!	realitytvgypsy MarkYoungTruth BFT_Podcast	0.374	0.626	0.0	-0.6351
1302	2017-10-18 19:24:13	0.0		[]	9.20792664349e+17	[]	https://twitter.com/Zeld7Rock/status/920792664349351936	0.0	I present you with Hollywood's bravest woman - Ashley Judd .	Zeld7Rock AshleyJudd	0.0	0.68	0.32	0.5106
1303	2017-10-18 19:21:39	0.0		[]	9.20792018104e+17	[]	https://twitter.com/makhaan_d/status/920792018103627776	0.0	Yep! Yep! She is an extremely nasty woman! I can't even imagine the vile things Ashley Judd did for her acting career!!!	makhaan_d MADE__USA	0.3	0.556	0.144	-0.7757
1304	2017-10-18 18:53:40	0.0		[]	9.20784977776e+17	['@BerlinStation']	https://twitter.com/BiglyMassive/status/920784977775726592	0.0	"Ashley Judd RUINED @BerlinStation 
Shes NOT believable in the role&makes it seem like a cheap soap opera
REALLY disappointed&cancelled Epix"	BiglyMassive EpixHD BerlinStation	0.164	0.729	0.107	-0.3254
1305	2017-10-18 18:30:37	1.0		[]	9.20779174855e+17	[]	https://twitter.com/bernalacin35/status/920779174855442433	0.0	Ashley Judd . Asia Argento da tecavüze uğradığını açıkladı. Biraz birlik olunup eş zamanlı geldi sonra gerisi	bernalacin35 goncakarakas	0.0	1.0	0.0	0.0
1306	2017-10-18 18:06:08	0.0		[]	9.20773013872e+17	[]	https://twitter.com/TaisieNoel/status/920773013871714304	0.0	Ashley Judd on 'Berlin Station' Season 2 & Working with David Lynch on 'Twin Peaks' http://fb.me/2s9lInjYj	TaisieNoel	0.0	1.0	0.0	0.0
1307	2017-10-18 18:03:46	0.0		[]	9.20772419702e+17	[]	https://twitter.com/realKevinDamato/status/920772419702444034	0.0	Who was bullying Ashley Judd 2 months ago, 3 months ago, 4 months ago? Aren’t you suppose to believe women are strong and capable?	realKevinDamato sarahundart	0.138	0.639	0.222	0.3313
1308	2017-10-18 17:34:35	1.0		[]	9.20765076986e+17	[]	https://twitter.com/RonDeplorable/status/920765076986097664	0.0	Ashley Judd sure is sick and self serving.	RonDeplorable ColleenJensen17 AshleyJudd	0.284	0.517	0.198	-0.25
1309	2017-10-18 16:49:17	0.0		[]	9.20753676318e+17	[]	https://twitter.com/PhillyGuy1959/status/920753676318371842	0.0	Ashley Judd Wants To Live In Middle East Gets Unexpected Surprise!… http://news4everyday.com/2017/08/26/loud-mouth-liberal-ashley-judd-wants-to-live-in-middle-east-where-women-have-more-rights-gets-unexpected-surprise-2/…	PhillyGuy1959	0.0	1.0	0.0	0.0
1310	2017-10-18 16:35:08	0.0		[u'#DrainTheSwamps']	9.20750112188e+17	[]	https://twitter.com/ACatholicKnight/status/920750112187527168	0.0	"Like Ashley Judd Madonna Jane Fonda and Bumblin' Stumblin' Drunkun' Her Lowness Hillary Clinton.. to name a few.

#DrainTheSwamps https://twitter.com/KTHopkins/status/920722299598360576…"	ACatholicKnight	0.106	0.78	0.115	0.0516
1311	2017-10-18 16:34:47	19.0		[u'#Weinstein']	9.20750025575e+17	[]	https://twitter.com/TEN4Texas/status/920750025575190534	11.0	I’m sorry Marylene, but Ashley Judd misfortune with #Weinstein doesn’t excuse her inherent ignorance or despicable behaviors against America	TEN4Texas marylene58 The_Hermithood	0.201	0.732	0.066	-0.4497
1312	2017-10-18 16:33:04	10.0		[u'#MAGA', u'#tcot']	9.20749592966e+17	[]	https://twitter.com/Freedom_Daily/status/920749592966074368	12.0	Loud-Mouth Liberal Ashley Judd Wants To Live In Middle East Where Women Have ‘More Rights,’ Gets… https://freedomdaily.com/liberal-ashley-judd-wants-to-live-in-middle-east-where-women-have-more-rights-gets-unexpected-surprise/?utm_source=dlvr.it&utm_medium=twitter… #MAGA #tcot	Freedom_Daily	0.0	1.0	0.0	0.0
1313	2017-10-18 19:03:50	0.0		[]	9.20787536666e+17	[]	https://twitter.com/harry_kanarie/status/920787536666136576	0.0	She is a gift.  She and Ashley Judd earn trump thousands of votes each.	harry_kanarie benshapiro	0.0	0.805	0.195	0.4404
1314	2017-10-18 18:41:10	0.0		[]	9.20781833063e+17	['@YouTube']	https://twitter.com/AmandaS82170842/status/920781833062830080	0.0	I added a video to a @YouTube playlist http://youtu.be/NG1ZnLCq5xs?a Loud Mouth Liberal Ashley Judd Wants To Live In Middle East Where Women	AmandaS82170842	0.0	1.0	0.0	0.0
1315	2017-10-18 16:05:21	0.0		[]	9.20742618753e+17	[]	https://twitter.com/BexLife/status/920742618753044482	0.0	"Tears, CHEERS, and so much love for what Ashley Judd says in this talk. 

Warning: Strong language and... http://fb.me/1CSW9c9t1"	BexLife	0.144	0.468	0.388	0.8523
1316	2017-10-18 15:54:29	0.0		[]	9.20739883853e+17	[]	https://twitter.com/dblane1971/status/920739883852890112	0.0	That would be Ashley Judd ’s take on it.	dblane1971 CHSommers benshapiro	0.0	1.0	0.0	0.0
1317	2017-10-18 15:54:13	0.0		[]	9.20739817084e+17	[]	https://twitter.com/JosephBLivi4/status/920739817083850752	0.0	Safe to say Harvey Weinstein had enablers both, males and females, If Ashley Judd to deny knowledge, she also would be self described naïve!	JosephBLivi4 RightWingCurry GregNorberg AshleyJudd	0.087	0.797	0.116	0.2003
1318	2017-10-18 15:54:03	1.0		[]	9.20739776647e+17	[]	https://twitter.com/doodlebug70/status/920739776646574080	0.0	When Ashley Judd spoke out against Weinstein  my first thought was her in that awful hat shouting grotesque obscenities with a microphone	doodlebug70 aspree	0.13	0.87	0.0	-0.4588
1319	2017-10-18 15:46:56	1.0		['#realestate', '#ai', '#cryptocurrency']	9.20737985247e+17	[]	https://twitter.com/shopseasonal/status/920737985246781440	0.0	Harvey Weinstein accusers now more than 40 It started with Ashley Judd . The New ... http://twib.in/l/kap8Mgdgb87a #realestate #ai #cryptocurrency	shopseasonal	0.0	1.0	0.0	0.0
1320	2017-10-18 15:39:24	2.0		[]	9.20736088998e+17	[]	https://twitter.com/MWallsk/status/920736088997748737	0.0	"October Horrorthon Movie 14

BUG (2006) 100 min. of Ashley Judd and Michael Shannon completely destroying. Hypnotic and frenzied. /5"	MWallsk MWallsk	0.17	0.83	0.0	-0.5984
1321	2017-10-18 15:35:25	3.0		[]	9.20735085779e+17	[]	https://twitter.com/Jodylj15/status/920735085778923520	0.0	Ashley Judd should have spoken up when it happened! She was well aware of what she was doing it's all about fame and money! Nasty women!	Jodylj15 POETREEOTIC	0.111	0.708	0.181	0.3129
1322	2017-10-18 15:25:50	0.0		[]	9.20732671827e+17	[]	https://twitter.com/Davisfortrump/status/920732671826976768	0.0	Maybe this explains why ashley judd is so vulgar. At that womans rally her demeanor was disgusting to other women.	Davisfortrump CNN	0.152	0.848	0.0	-0.5267
1323	2017-10-18 15:16:58	0.0		[]	9.20730440474e+17	[]	https://twitter.com/nojunkinmytrunk/status/920730440473784320	1.0	Of course it does, Ashley Judd checks her daily.	nojunkinmytrunk cliffhangernlv	0.0	1.0	0.0	0.0
1324	2017-10-18 15:01:49	0.0		[]	9.20726629378e+17	[]	https://twitter.com/tekaran/status/920726629378396160	0.0	I wonder if Ashley Judd is going to call him a Naaasssty Man, like she did Trump?	tekaran CNN	0.0	0.848	0.152	0.3612
1325	2017-10-18 14:58:50	0.0		[]	9.20725877436e+17	[]	https://twitter.com/BethStoneking/status/920725877436100609	0.0	Alyssa Milano is throwing things hoping something will stick. Honey your 15 minutes are long gone. Go away and take Ashley Judd with you.	BethStoneking chicksonright	0.0	0.891	0.109	0.4215
1326	2017-10-18 14:55:35	0.0		[]	9.20725063112e+17	[]	https://twitter.com/BreakingNewsGl2/status/920725063111987206	0.0	Tôi đã thêm video vào danh sách phát http://youtu.be/8Zni2p----U?a Loud Mouth Liberal Ashley Judd Wants To Live In Middle East Where	BreakingNewsGl2	0.0	1.0	0.0	0.0
1327	2017-10-18 14:48:01	0.0		[]	9.20723157266e+17	[]	https://twitter.com/HuckleberryBull/status/920723157266309121	0.0	Ashley Judd No one is stopping you GO! https://twitter.com/ord3001/status/920719515524022272…	HuckleberryBull ord3001	0.369	0.631	0.0	-0.4753
1328	2017-10-18 14:47:11	8.0		[u'#Liberal', u'#Live', u'#Women', u'#Rights']	9.20722946368e+17	[]	https://twitter.com/USSANews/status/920722946368212992	6.0	Loud-Mouth #Liberal Ashley Judd Wants To #Live In Middle East Where #Women Have ‘More #Rights,’ Gets Unexpected Surprise! - ...	USSANews	0.0	0.883	0.117	0.3382
1329	2017-10-18 14:30:15	1.0		[]	9.20718685379e+17	[]	https://twitter.com/Missing_Winnie/status/920718685379084289	0.0	"Ashley Judd hasn’t surpassed 7th grade 

https://freedomdaily.com/liberal-ashley-judd-wants-to-live-in-middle-east-where-women-have-more-rights-gets-unexpected-surprise/…"	Missing_Winnie	0.0	1.0	0.0	0.0
1330	2017-10-18 14:19:35	1.0		[]	9.20716003382e+17	[]	https://twitter.com/RealDavidIsrael/status/920716003381624832	0.0	A very large joke - 16, 50, 18 - Anderson's HR totals in consecutive seasons. Ashley Judd is great, put not that empowering.	RealDavidIsrael hbryant42 kengurnick	0.0	0.732	0.268	0.7635
1331	2017-10-18 14:11:09	0.0		[]	9.20713880808e+17	[]	https://twitter.com/BetaNipson/status/920713880808148992	0.0	Men?! How about that march of pussycat hats last January? Gross. Guess delicate little Ashley Judd isn't such a nasty girl after all	BetaNipson lightning989	0.115	0.707	0.178	0.1719
1332	2017-10-18 14:06:25	0.0		[]	9.20712686526e+17	[]	https://twitter.com/maplewhite1912/status/920712686526136320	0.0	anche quelle meno conosciute come Rosanna Arquette, Mira Sorvino (bravissima), Ashley Judd , etc.. Ho letto l'intervista a Miriana Trevisan.	maplewhite1912 rickyriga94	0.0	1.0	0.0	0.0
1333	2017-10-18 13:53:04	15.0		[]	9.2070932657e+17	[]	https://twitter.com/womensmediacntr/status/920709326569967625	6.0	Ashley Judd will be celebrated with the WMC Speaking Truth to Power Award at the Women's Media Awards in NYC!   http://bit.ly/2i82bo4	womensmediacntr	0.0	0.571	0.429	0.9151
1334	2017-10-18 13:44:14	8.0		[u'#']	9.20707103853e+17	[]	https://twitter.com/womensmediacntr/status/920707103853109248	8.0	Watch Ashley Judd 's Powerful Call to Action on Online Abuse - Women’s Media Center http://www.womensmediacenter.com/speech-project/watch-ashley-judds-powerful-call-to-action-on-online-abuse#.WeeS7NFWQpQ.twitter…	womensmediacntr	0.21	0.65	0.14	-0.34
1335	2017-10-18 13:39:39	2.0		[]	9.20705952441e+17	['@TheView']	https://twitter.com/ReiserWilliam/status/920705952441143301	1.0	I've been put in twitter jail 6 times-I would use profanity on Hillary- Ashley Judd & the Witches of @TheView	ReiserWilliam camarogirl91 MichelleRMed	0.0	1.0	0.0	0.0
1336	2017-10-18 13:30:36	0.0		['#strawman', '#speakup']	9.20703672975e+17	[]	https://twitter.com/TheRockist/status/920703672975282177	0.0	Gwyneth Paltrow & Ashley Judd are pushing 50. They aren't 22 now, and haven't been for many media saturated years. #strawman #speakup	TheRockist	0.0	1.0	0.0	0.0
1337	2017-10-18 13:25:43	0.0		['#FakeTears']	9.20702446976e+17	[]	https://twitter.com/ChiSoxGnome/status/920702446976069634	0.0	Their #FakeTears mean nothing. Their paid to pretend, so Ashley Judd screaming about periods, now crying over this is all an act.	ChiSoxGnome BigMan_OnCampus OwenBenjamin	0.279	0.721	0.0	-0.7479
1338	2017-10-18 13:25:06	18.0		[]	9.20702290017e+17	[]	https://twitter.com/IAmJamesTheBond/status/920702290016776192	24.0	"Ashley Judd e Meryl Streep fecero campagna per la Clinton dando del maschilista a Trump, elogiavano ""Dio Weinstein"": https://www.youtube.com/watch?v=zoh3HfxHWp4…"	IAmJamesTheBond IAmJamesTheBond LucioMalan	0.0	1.0	0.0	0.0
1339	2017-10-18 13:02:01	0.0		[]	9.20696479597e+17	[]	https://twitter.com/EdmondsRyan76/status/920696479597105152	0.0	Kind of like the well respected Ashley Judd ?	EdmondsRyan76 kentuckycrazies ESPNPR	0.0	0.394	0.606	0.7717
1340	2017-10-18 12:55:38	1.0		[]	9.20694873955e+17	[]	https://twitter.com/GlockandRoller/status/920694873954627584	0.0	I guess it is part of the “Nasty Woman” movement. Remember Ashley Judd talking about her period blood? Just ewww!	GlockandRoller icanthearyou123 Cosmopolitan	0.0	1.0	0.0	0.0
1341	2017-10-18 12:30:56	1.0		[]	9.20688659066e+17	[]	https://twitter.com/UnapologeticD_/status/920688659065647105	1.0	Link in Bio! tune into S3:Episode 23-Me Too. We discuss Harvey Weinstein’s sexual assault scandals, Ashley Judd turning down his sexual...	UnapologeticD_	0.277	0.723	0.0	-0.807
1342	2017-10-18 12:14:23	10.0		[]	9.20684494654e+17	[]	https://twitter.com/MikeSalvi59/status/920684494654464000	6.0	Brave Ashley Judd , spoke up against Trump all while protecting the real rapists with her silence. That's nasty. https://twitter.com/gregnorberg/status/920475627894980608…	MikeSalvi59 GregNorberg	0.289	0.586	0.125	-0.6705
1343	2017-10-18 12:07:27	0.0		[]	9.20682747354e+17	[]	https://twitter.com/Hay_eliz/status/920682747353554944	0.0	"Ashley Judd claims Weinstein assaulted her in 1997 yet made 2 more movies with him after that, ""Frida"" in 2002 & ""Crossing Over"" 2009.Hmmm"	Hay_eliz womensmediacntr AshleyJudd	0.139	0.861	0.0	-0.5267
1344	2017-10-18 11:42:53	0.0		[]	9.20676566589e+17	[]	https://twitter.com/1Rell_Of_A_Guy/status/920676566589493249	0.0	"Like I saw Ashley Judd talking avout her experience.. and I'm like ""you didn't know this was wrong then? Or did you just want that role"""	1Rell_Of_A_Guy	0.102	0.691	0.207	0.296
1345	2017-10-18 11:38:10	0.0		[]	9.20675378116e+17	[]	https://twitter.com/hearing12344/status/920675378116431872	0.0	You Rock, Ashley Judd !!!	hearing12344 womensmediacntr AshleyJudd	0.0	1.0	0.0	0.0
1346	2017-10-18 11:34:32	0.0		[]	9.20674465348e+17	[]	https://twitter.com/SaCDav/status/920674465347981314	3.0	Don't leave out her epithet: Nasty Ashley Judd .	SaCDav autumkat USAlivestrong	0.335	0.558	0.107	-0.5349
1347	2017-10-18 11:22:26	0.0		[u'#1']	9.20671419864e+17	[u'@YouTube']	https://twitter.com/salazarlucio3/status/920671419863851008	0.0	Me ha gustado un vídeo de @YouTube (http://youtu.be/Ft_V73a87EY?a - Good Kids Official Trailer #1 (2016) Zoey Deutch, Ashley Judd Comedy	salazarlucio3	0.0	0.672	0.328	0.7783
1348	2017-10-18 11:20:51	0.0		[]	9.20671023557e+17	[]	https://twitter.com/KatyVaux36/status/920671023556567041	0.0	"Ashley Judd is quoted as saying, ""I'm a bad, bad woman."" Proudly. https://twitter.com/VivaLaAmesX/status/920025648911052800…"	KatyVaux36	0.357	0.459	0.184	-0.5267
1349	2017-10-18 11:02:50	1.0		[]	9.20666487052e+17	[]	https://twitter.com/tedhood16/status/920666487051796481	1.0	Curious to know who does Ashley Judd 's PR? How could you screw up a brand or reputation any worse?I presume even the left think she's Looney https://twitter.com/GregNorberg/status/920475627894980608…	tedhood16 GregNorberg	0.048	0.86	0.092	0.3094
