Unnamed: 0	date	favorites	geo	hashtags	id	mentions	permalink	retweets	text	username	neg	neu	pos	compound
1798	2017-10-23 11:53:46	0.0		[]	9.22491244865e+17	[]	https://twitter.com/victoriathomsom/status/922491244864868352	0.0	Ashley Judd the nasty woman that said nothing as long as it was a benefit to her career. Hollywood whores coming out of the woodwork now.	victoriathomsom DRUDGE_REPORT	0.233	0.675	0.092	-0.6808
1799	2017-10-23 11:52:28	0.0		[]	9.22490919236e+17	[]	https://twitter.com/pgm2015Nov/status/922490919235891200	0.0	"Ashley Judd raped by Weinstein-no problem. Offended by POTUS locker room talk 13yrs ago.
Hypocrisy is astounding!"	pgm2015Nov	0.378	0.512	0.11	-0.7777
1800	2017-10-23 11:49:52	7.0		[]	9.22490264614e+17	[]	https://twitter.com/heraldleader/status/922490264614309890	1.0	"ABC will interview Ashley Judd for the first time since she went public with allegations against Harvey Weinstein.

http://www.kentucky.com/entertainment/article180375746.html…"	heraldleader	0.0	1.0	0.0	0.0
1801	2017-10-23 11:46:48	0.0		[]	9.2248949347e+17	[]	https://twitter.com/marsh_jimmie5/status/922489493470437376	0.0	"Ashley Judd to Harvey Weinstein: ""Grab me by the pussy"""	marsh_jimmie5 AshleyJudd	0.0	1.0	0.0	0.0
1802	2017-10-23 11:44:01	0.0		[u'#utm_medium']	9.22488790077e+17	[u'@variety']	https://twitter.com/GikeMulley/status/922488790077394944	0.0	You're not brave and not a hero. Ashley Judd Sets First TV Interview After Harvey Weinstein Allegation http://variety.com/2017/tv/news/ashley-judd-harvey-weinstein-diane-sawyer-abc-news-1202596357/#utm_medium=social&utm_source=twitter&utm_campaign=social_bar&utm_content=bottom&utm_id=1202596357… via @variety	GikeMulley	0.251	0.749	0.0	-0.6908
1803	2017-10-23 11:35:46	0.0		[]	9.2248671328e+17	[]	https://twitter.com/PS641600/status/922486713280278528	0.0	Ashley Judd to Give First TV Interview After Weinstein Allegations... http://feedproxy.google.com/~r/DrudgeReportFeed/~3/aqpETeW8ljc/…	PS641600	0.0	1.0	0.0	0.0
1804	2017-10-23 11:33:34	0.0		[]	9.22486159511e+17	[]	https://twitter.com/burgundy50/status/922486159510573057	0.0	My opinion, Ashley Judd would’ve been better in this role. https://twitter.com/enews/status/922482508394106885…	burgundy50 enews	0.0	0.775	0.225	0.4404
1805	2017-10-23 11:30:56	10.0		[]	9.22485500422e+17	[]	https://twitter.com/Housewife_Probs/status/922485500421779458	0.0	Ashley Judd considered being called 'sweetheart' sexual harassment..Some are being truthful - some exaggerate to the fullest. *shrug*	Housewife_Probs StarvingAuthor AmiriKing	0.082	0.765	0.153	0.34
1806	2017-10-23 11:28:07	1.0		[]	9.22484790276e+17	[]	https://twitter.com/seattlepi/status/922484790275612677	0.0	Weinstein accuser Ashley Judd to be interviewed by ABC News http://dlvr.it/Px9jBJ	seattlepi	0.0	1.0	0.0	0.0
1807	2017-10-23 11:20:25	2.0		['#Weinstein', '#ABCNews']	9.2248285062e+17	[]	https://twitter.com/APEntertainment/status/922482850619936773	2.0	"#Weinstein accuser Ashley Judd to be interviewed by #ABCNews
http://apne.ws/77zaAiu"	APEntertainment	0.0	1.0	0.0	0.0
1808	2017-10-23 11:18:28	1.0		[u'#IMDbhttp']	9.22482360193e+17	[]	https://twitter.com/crazyantfilms/status/922482360192561152	1.0	"Ashley Judd Sets First TV Interview After Harvey Weinstein Allegation
#IMDbhttp://www.imdb.com/news/ni61645127/…"	crazyantfilms	0.0	1.0	0.0	0.0
1809	2017-10-23 11:17:13	0.0		[]	9.22482047939e+17	[]	https://twitter.com/orlandosentinel/status/922482047939174400	0.0	Ashley Judd talks Weinstein with ABC's Diane Sawyer http://thesent.nl/2zIRBYO	orlandosentinel	0.0	1.0	0.0	0.0
1810	2017-10-23 11:11:11	0.0		[]	9.22480527282e+17	[]	https://twitter.com/TheTVStation/status/922480527281672192	1.0	"""Weinstein Accuser Ashley Judd to Be Interviewed by ABC News"" by THE ASSOCIATED PRESS via NYT http://ift.tt/2ivQ6ZT"	TheTVStation	0.0	1.0	0.0	0.0
1811	2017-10-23 11:05:46	0.0		[]	9.22479164091e+17	[]	https://twitter.com/KatzenRobert/status/922479164090851328	0.0	Here’s a little song I wrote called: Ashley Judd eats the peanuts out of shit.	KatzenRobert realZiplok	0.231	0.769	0.0	-0.5574
1812	2017-10-23 11:02:53	0.0		[]	9.22478437956e+17	[]	https://twitter.com/CitaWertz/status/922478437956308992	0.0	ABC News says Ashley Judd will sit down with anchor Diane Sawyer for her first television interview since the actress-activist went public …	CitaWertz	0.0	1.0	0.0	0.0
1813	2017-10-23 10:59:59	2.0		[]	9.22477709552e+17	[]	https://twitter.com/quevinchase/status/922477709552480256	0.0	Well..... Ashley Judd did come forward and finally tell her story almost 20 yrs. later!That's worth something right?!?......	quevinchase PrisonPlanet	0.0	0.857	0.143	0.4299
1814	2017-10-23 10:53:11	1.0		[]	9.22475999304e+17	[]	https://twitter.com/gambler1647/status/922475999304003584	0.0	Good for Ashley Judd who waited how long to warn others of Weinstein's despicable depravity. Hollyweird desires fame and fortune the most!	gambler1647 DRUDGE_REPORT	0.053	0.717	0.23	0.69
1815	2017-10-23 10:51:14	0.0		[u'#HarveyWeinstein', u'#utm_medium']	9.22475507027e+17	[]	https://twitter.com/ACT0RSLIFE/status/922475507026767872	1.0	Ashley Judd Sets First TV Interview After #HarveyWeinstein Allegationhttp://variety.com/2017/tv/news/ashley-judd-harvey-weinstein-diane-sawyer-abc-news-1202596357/#utm_medium=social&utm_source=twitter&utm_campaign=social_bar&utm_content=bottom&utm_id=1202596357…	ACT0RSLIFE	0.0	1.0	0.0	0.0
1816	2017-10-23 10:49:57	0.0		[]	9.22475186213e+17	[]	https://twitter.com/cdg2373/status/922475186213085189	0.0	Ashley Judd is a snowflake liberal whiner but when it comes to her own pocket she will remain quiet and let it happen.  Maybe she liked it?	cdg2373 Lrihendry	0.055	0.819	0.126	0.4767
1817	2017-10-23 10:41:41	0.0		[]	9.22473106576e+17	['@MaaneKhat']	https://twitter.com/MLMusic/status/922473106576326657	0.0	@MaaneKhat Ashley Judd article - I think you meant HARROWING not borrowing. Spellcheck can be malicious!	MLMusic	0.0	1.0	0.0	0.0
1818	2017-10-23 10:37:58	0.0		[]	9.22472167744e+17	['@ABC', '@DianeSawyer']	https://twitter.com/NadineatABC/status/922472167744393216	1.0	Ashley Judd gives 1st TV interview to @ABC's @DianeSawyer since she went public w/ her allegations about Weinstein:https://goo.gl/mZuLDZ	NadineatABC	0.0	1.0	0.0	0.0
1819	2017-10-23 10:37:14	0.0		[]	9.22471983019e+17	[]	https://twitter.com/mobes1/status/922471983018897408	0.0	You do know Ashley Judd is kind of an f’d up person herself right https://twitter.com/bosnerdley/status/922471732841275392…	mobes1 BoSnerdley	0.0	1.0	0.0	0.0
1820	2017-10-23 10:36:14	3.0		[]	9.22471732841e+17	[u'@thr']	https://twitter.com/BoSnerdley/status/922471732841275392	0.0	Ashley Judd Sets First TV Interview on Harvey Weinstein http://www.hollywoodreporter.com/news/ashley-judd-sets-first-tv-interview-harvey-weinstein-1051046… via @thr	BoSnerdley	0.0	1.0	0.0	0.0
1821	2017-10-23 10:34:46	1.0		[]	9.22471362883e+17	[]	https://twitter.com/vachilly64/status/922471362882621440	0.0	I assume by the face Hamilton was not your pick. Who's the guy that was married to Ashley Judd ? Did he drive?	vachilly64 BlueRidgeLEO	0.0	1.0	0.0	0.0
1822	2017-10-23 10:33:41	3.0		[]	9.22471089531e+17	[]	https://twitter.com/triadaxiom/status/922471089531490306	0.0	How many women were unnecessarily harassed and assaulted because Ashley Judd and others did not speak up earlier about Weinstein?	triadaxiom DRUDGE_REPORT	0.277	0.723	0.0	-0.7845
1823	2017-10-23 10:30:48	0.0		[]	9.22470367243e+17	[]	https://twitter.com/AvaAssistant/status/922470367242932227	0.0	http://Variety.com: Ashley Judd to Give First TV Interview After Weinstein Allegation to ABC News’ Diane S... http://ow.ly/UFB350eLvXW	AvaAssistant	0.0	1.0	0.0	0.0
1824	2017-10-23 10:27:37	4.0		[]	9.22469562612e+17	[]	https://twitter.com/meflaherty/status/922469562611888129	0.0	Ashley Judd is a wacko.  Don’t care what she says.	meflaherty DRUDGE_REPORT	0.0	0.714	0.286	0.4939
1825	2017-10-23 10:26:29	0.0		[]	9.22469278657e+17	[]	https://twitter.com/attorneydad/status/922469278657363969	0.0	Part of me knows Alyssa Milano, Ashley Judd , and Winona Ryder are different ppl but, not the eyes or the memory.	attorneydad	0.0	1.0	0.0	0.0
1826	2017-10-23 10:25:28	36.0		[]	9.22469023732e+17	[]	https://twitter.com/THR/status/922469023731863555	12.0	Ashley Judd sets first TV interview on Harvey Weinstein http://thr.cm/Vw4g3A	THR	0.0	1.0	0.0	0.0
1827	2017-10-23 10:23:18	0.0		[]	9.22468478212e+17	[]	https://twitter.com/13comsense/status/922468478212300800	0.0	"Ashley Judd Will always find a way to get attention.
It is a precursor to her Liberal Political Plans."	13comsense	0.0	1.0	0.0	0.0
1828	2017-10-23 10:22:33	42.0		[]	9.22468288403e+17	[]	https://twitter.com/DRUDGE_REPORT/status/922468288403091459	22.0	Ashley Judd to Give First TV Interview After Weinstein Allegation to Diane Sawyer... http://bit.ly/2h11Wry	DRUDGE_REPORT	0.0	1.0	0.0	0.0
1829	2017-10-23 10:12:52	2.0		[]	9.22465854503e+17	[]	https://twitter.com/bostonherald/status/922465854503170054	0.0	Ashley Judd to give first TV interview after Weinstein allegation to ABC News' Diane Sawyer http://bhne.ws/wHDKjIH	bostonherald	0.0	1.0	0.0	0.0
1830	2017-10-23 10:11:58	2.0		[]	9.22465626505e+17	['@ABC', '@DianeSawyer']	https://twitter.com/rickklein/status/922465626504953856	2.0	Ashley Judd gives 1st TV interview to @ABC's @DianeSawyer since she went public w/ her allegations about Weinstein:https://goo.gl/mZuLDZ	rickklein	0.0	1.0	0.0	0.0
1831	2017-10-23 09:58:23	0.0		[]	9.22462209104e+17	[]	https://twitter.com/eScarry/status/922462209103597568	0.0	Diane Sawyer interview with Ashley Judd airing Thursday on ABC	eScarry	0.0	1.0	0.0	0.0
1832	2017-10-24 19:56:22	6.0		['#1']	9.2297508158e+17	[]	https://twitter.com/Kelkat66/status/922975081579597824	0.0	The guy that replaced Ashley Judd as UK's #1 most known fan.	Kelkat66 thrashman714 UKCoachCalipari Drake	0.0	0.81	0.19	0.3774
1833	2017-10-24 19:47:20	1.0		['#MeToo']	9.22972808934e+17	[]	https://twitter.com/truthhurtsxxxxx/status/922972808933707776	1.0	#MeToo has now turned into a joke. Ashley Judd who claims to be a dirty girl knew for yrs. Toxic masculinity is their issue they claim.	truthhurtsxxxxx	0.107	0.812	0.081	-0.1779
1834	2017-10-24 19:37:10	0.0		['#trendinghttp']	9.22970251696e+17	[]	https://twitter.com/DRL_Trending/status/922970251695935488	0.0	Weinstein accuser Ashley Judd to be interviewed by ABC News #trendinghttp://ift.tt/2ldGIuT	DRL_Trending	0.0	1.0	0.0	0.0
1835	2017-10-24 19:27:44	0.0		[]	9.22967878324e+17	[]	https://twitter.com/skylark723/status/922967878323798016	0.0	So she is being awarded at the same time as Ashley Judd and Jane Fonda... two malicious people and Hanoi Jane is a traitor. A traitors	skylark723 RealJamesWoods	0.0	0.895	0.105	0.4019
1836	2017-10-24 19:26:14	1.0		[]	9.22967500253e+17	[]	https://twitter.com/newmoney/status/922967500253474816	0.0	_____ is to ending Donald Trump’s career what Ashley Judd ’s story was to snowballing the Harvey Weinstein story/career.	newmoney	0.0	1.0	0.0	0.0
1837	2017-10-24 19:17:17	0.0		[]	9.22965248449e+17	[]	https://twitter.com/WoodmansCOL/status/922965248449052672	0.0	◔• Someone Like You DVD Ashley Judd , Greg Kinnear, Hugh Jackman NEW~SEALED Best Value http://ebay.to/2i3wpok	WoodmansCOL	0.0	0.569	0.431	0.8442
1838	2017-10-24 19:14:14	0.0		[]	9.22964477968e+17	[]	https://twitter.com/MarkovTrump_/status/922964477968084992	0.0	theToday Show was the Democrats are u soon to people think that you will be because her wherever she should never made Ashley Judd 's	MarkovTrump_	0.0	1.0	0.0	0.0
1839	2017-10-24 19:10:34	0.0		[]	9.22963558241e+17	[]	https://twitter.com/joejohnson291/status/922963558241062913	0.0	Ashley Judd is an alcoholic that can't remember who she was with yesterday.	joejohnson291 samuelcpw	0.0	1.0	0.0	0.0
1840	2017-10-24 19:05:00	44.0		[]	9.22962157297e+17	['@DianeSawyer', '@GMA']	https://twitter.com/GMA/status/922962157297217536	4.0	THURSDAY: Ashley Judd with @DianeSawyer in her first TV interview since going public with allegations about Harvey Weinstein, first on @GMA.	GMA	0.0	1.0	0.0	0.0
1841	2017-10-24 18:25:48	3.0		[]	9.2295228966e+17	[]	https://twitter.com/ianberg/status/922952289660186624	0.0	Presumably it will star Matt Damon & Ashley Judd .	ianberg jtLOL	0.0	1.0	0.0	0.0
1842	2017-10-24 18:24:19	2.0		[]	9.22951916648e+17	[]	https://twitter.com/ashleymacc_/status/922951916648267778	0.0	24 years later and my mom finally tells me she got my name from Ashley Judd	ashleymacc_	0.0	1.0	0.0	0.0
1843	2017-10-24 18:18:39	0.0		[]	9.22950491759e+17	[]	https://twitter.com/PimaCotton1/status/922950491759198208	0.0	. You're sounding way too much like Ashley Judd The Nasty Girl	PimaCotton1 PattyArquette	0.238	0.596	0.166	-0.2732
1844	2017-10-24 18:17:49	0.0		[]	9.22950280387e+17	[]	https://twitter.com/Road_King61/status/922950280387338240	0.0	He looks an awful lot like Ashley Judd with tattoos	Road_King61 TheWrightWingv2	0.222	0.593	0.185	-0.128
1845	2017-10-24 18:02:19	0.0		[]	9.22946381815e+17	[]	https://twitter.com/INDCarSerious/status/922946381815234560	0.0	Who can guess what track, and when I took these of Ashley Judd ? Whoever guesses right gets a free Trashley Hat. Just kidding.	INDCarSerious	0.0	0.802	0.198	0.5719
1846	2017-10-24 17:41:32	0.0		[]	9.22941150197e+17	[]	https://twitter.com/yardonna/status/922941150197149697	0.0	isn't that ashley judd ? https://twitter.com/Nancy007F/status/922938185427984384…	yardonna	0.0	1.0	0.0	0.0
1847	2017-10-24 17:00:06	0.0		[]	9.22930724487e+17	['@YouTube']	https://twitter.com/newschannel7/status/922930724487028740	0.0	Harvey Weinstein accuser Ashley Judd sets 1st TV interview, with Diane Sawyer: http://youtu.be/4oAfxzDp_tc?a qua @YouTube	newschannel7	0.0	1.0	0.0	0.0
1848	2017-10-24 16:42:39	0.0		[]	9.22926331394e+17	[]	https://twitter.com/JohnNada_/status/922926331393748992	0.0	Someone like James Woods who never worked with or got finger-blasted by Harvey is not culpable compared to Matt Damon or Ashley Judd	JohnNada_ MaggotMagnet bobsanders345	0.0	0.898	0.102	0.3612
1849	2017-10-24 16:39:28	0.0		[]	9.22925530823e+17	[]	https://twitter.com/CatsofVelvet/status/922925530822819840	0.0	"ASHLEY JUDD IS A GOOD ACTRESS BUT

SHE IS A TOTAL NUTCAS"	CatsofVelvet	0.0	0.822	0.178	0.2382
1850	2017-10-24 16:30:23	0.0		['#Trump', '#metoo']	9.22923244482e+17	[]	https://twitter.com/evry2min/status/922923244482469888	0.0	Rape Survivor Ashley Judd Explains Why #Trump Triggers So Many Survivors http://ow.ly/3e9k30fO6I2 #metoo	evry2min	0.258	0.604	0.137	-0.4939
1851	2017-10-24 19:05:47	0.0		[]	9.22962353406e+17	[]	https://twitter.com/WHAS11DRose/status/922962353406300163	0.0	THURSDAY: Ashley Judd with DianeSawyer in her first TV interview since going public with allegations about Harvey… https://twitter.com/i/web/status/922962157297217536…	WHAS11DRose	0.0	1.0	0.0	0.0
1852	2017-10-24 16:04:08	0.0		[]	9.22916637791e+17	[]	https://twitter.com/eLouSedator/status/922916637791023104	0.0	best case scenario, for something good coming from this: it results in linda sarsour & ashley judd getting into a catfight	eLouSedator realDailyWire	0.0	0.705	0.295	0.7964
1853	2017-10-24 15:28:50	32.0		[]	9.22907754087e+17	[]	https://twitter.com/jowrotethis/status/922907754087440384	5.0	...Flake and Corker are good starts but they’re no Ashley Judd . They’re LEAVING the fight. Stay. Fight.	jowrotethis jowrotethis	0.391	0.53	0.079	-0.8248
1854	2017-10-24 15:08:22	0.0		[]	9.22902604153e+17	[]	https://twitter.com/Mario58857682/status/922902604153159681	0.0	Y la de El GranSimon? Ahi donde sale el bom bom de Ashley Judd	Mario58857682 Mr_Bukowski	0.0	1.0	0.0	0.0
1855	2017-10-24 15:00:09	5.0		[]	9.22900536676e+17	['@DianeSawyer']	https://twitter.com/InStyle/status/922900536676028417	0.0	.@DianeSawyer will interview Ashley Judd about those Harvey Weinstein allegations http://instyle.io/Dre4JTZ	InStyle	0.0	1.0	0.0	0.0
1856	2017-10-24 14:51:17	3.0		['#screamatthesky']	9.22898307756e+17	[]	https://twitter.com/marievonastra/status/922898307755716610	1.0	These people are literally possessed - by imps from hell (or Ashley Judd ).  #screamatthesky	marievonastra PrisonPlanet	0.261	0.739	0.0	-0.6808
1857	2017-10-24 14:49:14	0.0		[]	9.22897792188e+17	[]	https://twitter.com/grumpycloud/status/922897792187715585	0.0	"""Berlin Station"". Riktig bra serie. Tickar alla mina boxar: spioner, Berlin, bra skådisar (Rhys Ifans, Ashley Judd ), bra soundtrack."	grumpycloud	0.0	1.0	0.0	0.0
1858	2017-10-24 14:47:22	0.0		[]	9.22897320199e+17	[u'@WatchChad']	https://twitter.com/BrendaBoothe4/status/922897320198508546	0.0	WATCH: “ Ashley Judd ” is BACK and This Time She’s Really Mad! https://politicalcowboy.com/watch-ashley-judd-back-time-shes-really-mad/… via @WatchChad	BrendaBoothe4	0.201	0.799	0.0	-0.5838
1859	2017-10-24 14:45:00	0.0		[]	9.22896723618e+17	[]	https://twitter.com/Kevin_Trump_Man/status/922896723617505280	0.0	Freddie ‘flipped out’ Wilson appears to have replaced Ashley Judd and Madonna as a voice of Planned Parenthood	Kevin_Trump_Man MADE__USA	0.0	1.0	0.0	0.0
1860	2017-10-24 13:23:24	0.0		[u'#']	9.228761882e+17	[]	https://twitter.com/GG1725/status/922876188200243201	0.0	# Ashley Judd wackjob https://twitter.com/GG1725/status/922875685533777920…	GG1725 GG1725	0.0	1.0	0.0	0.0
1861	2017-10-24 12:58:32	0.0		[]	9.22869931565e+17	[]	https://twitter.com/TrendStyleDaily/status/922869931565375488	0.0	"Harvey Weinstein scandal: 'Wonder Woman' star Connie Nielsen says producer groped her

Meanwhile, Ashley Judd , one… http://rssfeeds.usatoday.com/~/477753326/0/usatoday-lifetopstories~Harvey-Weinstein-scandal-aposWonder-Womanapos-star-Connie-Nielsen-says-producer-groped-her/…"	TrendStyleDaily	0.153	0.847	0.0	-0.4404
1862	2017-10-24 11:51:19	0.0		[]	9.22853016348e+17	[]	https://twitter.com/ernest_cofield/status/922853016348348418	0.0	All Nasty people to include Ashley Judd .. they need Jesus.	ernest_cofield AnnaApp91838450 Truthseeker126	0.265	0.735	0.0	-0.5574
1863	2017-10-24 11:24:09	0.0		['#people', '#life']	9.22846178915e+17	['@InStyle']	https://twitter.com/susjcrusher/status/922846178915401729	0.0	#people #life Diane Sawyer Will Interview Ashley Judd About Harvey Weinstein Allegations http://dlvr.it/PxLww6 on @InStyle	susjcrusher	0.0	1.0	0.0	0.0
1864	2017-10-24 11:14:06	0.0		[]	9.22843650392e+17	[]	https://twitter.com/Remmy76535478/status/922843650391932929	0.0	So does alumni Ashley Judd !	Remmy76535478 RrealDJTrump JrcheneyJohn	0.0	1.0	0.0	0.0
1865	2017-10-24 11:08:07	0.0		[]	9.22842144846e+17	[]	https://twitter.com/Quendrith/status/922842144846389248	0.0	Ashley Judd , & many more who want the best years of their working lives back as actors are a little less rah-rah on *revolution* aspect...	Quendrith people	0.0	0.784	0.216	0.6983
1866	2017-10-24 11:03:29	0.0		[]	9.22840976947e+17	[]	https://twitter.com/TheAndiJ/status/922840976946880515	0.0	Have you read Ashley Judd 's memoir? It's amazing.	TheAndiJ quietgratitude	0.0	0.678	0.322	0.5859
1867	2017-10-24 10:52:59	0.0		[]	9.22838337756e+17	[]	https://twitter.com/CassidyMcM/status/922838337756446721	0.0	Ashley Judd will do first TV intrvw re Weinstein & sexual harassment, on ABC w Diane Sawyer http://bit.ly/2ivFrhP	CassidyMcM	0.189	0.811	0.0	-0.5423
1868	2017-10-24 10:13:16	2.0		[]	9.22828341258e+17	['@MichaelBerrySho', '@RamonRoblesJr']	https://twitter.com/MesquiteSmoker/status/922828341257953280	0.0	I just tuned into @MichaelBerrySho .  Is he talking about Ashley Judd @RamonRoblesJr	MesquiteSmoker	0.0	1.0	0.0	0.0
1869	2017-10-24 10:09:03	2.0		['#ThingsITrustMorethanCNN']	9.2282727801e+17	[]	https://twitter.com/LiamBBoggs/status/922827278010208256	0.0	"Saying ""Sweetheart"" to Ashley Judd . 

 #ThingsITrustMorethanCNN"	LiamBBoggs	0.0	1.0	0.0	0.0
1870	2017-10-24 10:01:18	0.0		[]	9.2282532937e+17	[u'@thr']	https://twitter.com/garymoore1985/status/922825329370173440	0.0	Ashley Judd Sets First TV Interview on Harvey Weinstein http://www.hollywoodreporter.com/news/ashley-judd-sets-first-tv-interview-harvey-weinstein-1051046… via @thr	garymoore1985	0.0	1.0	0.0	0.0
1871	2017-10-24 09:45:27	0.0		[]	9.22821340465e+17	[]	https://twitter.com/beautybydesy/status/922821340465455106	0.0	Diane Sawyer Will Interview Ashley Judd About Harvey Weinstein Allegations http://ow.ly/MJWh50eMKJJ	beautybydesy	0.0	1.0	0.0	0.0
1872	2017-10-24 09:29:15	0.0		[]	9.22817264386e+17	[]	https://twitter.com/sifto8888/status/922817264386297856	0.0	"Because she did threaten to ""take him out""..must think shes Madonna or Ashley judd / exonerated for vicious rhetoric"	sifto8888 zephbe ChrisCuomo	0.223	0.655	0.122	-0.3182
1873	2017-10-24 09:28:07	0.0		[]	9.22816976967e+17	[]	https://twitter.com/MarigoPR/status/922816976967426057	0.0	Ashley Judd , will be interviewed for the 1st time since going public about Weinstein. Judd’s talk with Diane Sawyer will air Thurs. Oct 26th	MarigoPR	0.0	1.0	0.0	0.0
1874	2017-10-24 09:27:23	0.0		[]	9.22816793777e+17	[]	https://twitter.com/fashion_x_style/status/922816793776758784	0.0	Diane Sawyer Will Interview Ashley Judd About Those Harvey Weinstein Allegations http://dlvr.it/PxKyTh	fashion_x_style	0.0	1.0	0.0	0.0
1875	2017-10-24 09:17:24	0.0		[]	9.22814283096e+17	[]	https://twitter.com/JSears68/status/922814283095986176	0.0	How about Amy as Ashley Judd ... do Nasty Woman poem... non-offensive since it's funny	JSears68 AmyJacobson DanProft MorningAnswer	0.185	0.667	0.149	-0.1779
1876	2017-10-24 09:00:37	0.0		[]	9.22810057309e+17	[]	https://twitter.com/osentertain/status/922810057309306880	0.0	Ashley Judd talks Weinstein with ABC's Diane Sawyer http://bit.ly/2yHuGzA	osentertain	0.0	1.0	0.0	0.0
1877	2017-10-24 08:56:36	0.0		[]	9.22809047552e+17	[]	https://twitter.com/dorettamills/status/922809047551750145	0.0	Harvey Weinstein and Ashley Judd http://fb.me/6CkMGuEaX	dorettamills	0.0	1.0	0.0	0.0
1878	2017-10-24 08:41:12	0.0		[]	9.22805170329e+17	[]	https://twitter.com/DeePrentiss/status/922805170328756224	0.0	"New tv show based on Ashley Judd interview with Diane Sawyer: 
""Diary of an Angry, White Feminist"""	DeePrentiss	0.171	0.829	0.0	-0.5106
1879	2017-10-24 08:18:51	0.0		[u'#utm_medium']	9.22799546732e+17	[u'@variety']	https://twitter.com/ciccolombo/status/922799546731819008	0.0	Ashley Judd Sets First TV Interview After Harvey Weinstein Allegation http://variety.com/2017/film/news/ashley-judd-harvey-weinstein-diane-sawyer-abc-news-1202596357/#utm_medium=social&utm_source=twitter&utm_campaign=social_bar&utm_content=bottom&utm_id=1202596357… via @variety	ciccolombo	0.0	1.0	0.0	0.0
1880	2017-10-24 07:28:00	1.0		[]	9.22786751227e+17	[]	https://twitter.com/heraldleader/status/922786751227355136	0.0	"Ashley Judd , an early accuser of Weinstein, has described an incident from two decades ago
http://www.kentucky.com/entertainment/article180375746.html…"	heraldleader	0.0	1.0	0.0	0.0
1881	2017-10-24 06:19:06	0.0		[]	9.22769411983e+17	[]	https://twitter.com/Misandry_Slayer/status/922769411982921728	0.0	Ashley Judd deserved niether.	Misandry_Slayer Misandry_Slayer emilia_suze	0.0	1.0	0.0	0.0
1882	2017-10-24 05:40:36	2.0		[]	9.22759720377e+17	[]	https://twitter.com/ABC7Autria/status/922759720376721409	3.0	"Weinstein Accuser Ashley Judd is sitting down with ABC's Diane Sawyer. Interview to air Thursday. 

 http://wjla.com/news/entertainment/weinstein-accuser-ashley-judd-to-be-interviewed-by-abc-news…"	ABC7Autria	0.0	1.0	0.0	0.0
1883	2017-10-24 05:37:47	0.0		[]	9.2275901307e+17	[]	https://twitter.com/newschannelnine/status/922759013070262272	0.0	Weinstein accuser Ashley Judd to be interviewed by ABC News: http://newschannel9.com/news/entertainment/weinstein-accuser-ashley-judd-to-be-interviewed-by-abc-news…	newschannelnine	0.0	1.0	0.0	0.0
1884	2017-10-24 04:20:17	0.0		[]	9.22739507925e+17	[]	https://twitter.com/LynnShawProd/status/922739507925016576	0.0	Ashley Judd , one of the actresses whose sexual assault allegations against Harvey Weinstein led to the producer’s... http://fb.me/1jfXCO07p	LynnShawProd	0.183	0.817	0.0	-0.5859
1885	2017-10-24 04:14:50	0.0		[]	9.22738139588e+17	[u'@RITACOSBY']	https://twitter.com/JAMESEDSTROM/status/922738139587858432	0.0	.@RITACOSBY Times Square Gossip: ASHLEY JUDD 'S WEINSTEIN ALLEGATIONS ON ABC http://www.timessquaregossip.com/2017/10/ashley-judds-weinstein-allegations-on.html?spref=tw…	JAMESEDSTROM	0.134	0.866	0.0	-0.1779
1886	2017-10-24 04:00:34	2.0		[]	9.2273454793e+17	['@Channel24']	https://twitter.com/News24/status/922734547929894912	2.0	"Ashley Judd to tell-all in first TV interview after Harvey Weinsten allegation | @Channel24 

http://ow.ly/SQXz30g5lAh"	News24	0.0	1.0	0.0	0.0
1887	2017-10-24 04:00:18	0.0		[]	9.2273448007e+17	[]	https://twitter.com/orlandosentinel/status/922734480070250496	1.0	Ashley Judd talks Weinstein with ABC's Diane Sawyer http://thesent.nl/2xjK2X6	orlandosentinel	0.0	1.0	0.0	0.0
1888	2017-10-24 03:55:02	0.0		[]	9.22733157069e+17	[]	https://twitter.com/Highlighthwd/status/922733157069283328	0.0	Ashley Judd Sets First TV Interview on Harvey Weinstein http://highlighthollywood.com/2017/10/ashley-judd-sets-first-tv-interview-on-harvey-weinstein/…	Highlighthwd	0.0	1.0	0.0	0.0
1889	2017-10-24 03:45:05	0.0		[]	9.22730652399e+17	[]	https://twitter.com/GoldeeGreen/status/922730652398702592	1.0	ASHLEY JUDD will be on GMA on Thursday to discuss the Weinstein story	GoldeeGreen	0.0	1.0	0.0	0.0
1890	2017-10-24 03:24:29	0.0		[]	9.22725466079e+17	[]	https://twitter.com/Buzzybuzz3/status/922725466078957568	0.0	New post ( Ashley Judd Will Give Her First Interview In Wake Of Scandal | Daily ...) has been published on Buzz ... - https://buzzybuzz.info/uncategorized/ashley-judd-will-give-her-first-interview-in-wake-of-scandal-daily-celebrity-news-splash-tv/…	Buzzybuzz3	0.121	0.879	0.0	-0.4404
